,date,title,score
1068,2016-01-08,ISIS wrote a six reasons listicle to explain why they hate the West,347
1056,2016-01-08,Netanyahu: “France funds Palestinian incitement and terror”,21
1064,2016-01-08,Rio 2016: Swimmers need to ingest only three teaspoons of water to be almost certain of contracting a virus | Olympics | Sport,15
1053,2016-01-08,"Recession ahead in Britain? Factories slow, business confidence tumbles",11
1063,2016-01-08,Tajikistan to fine journalists for unknown words,11
1073,2016-01-08,Belgian MP wants to scrap confidentiality rules for terror investigations: Social services staff would be required to report any signs clients are involved in terrorism,9
1078,2016-01-08,North Korea Declares War Against United States if Annual ‘War Games’ Go Ahead,8
1059,2016-01-08,Interpol arrests Nigerian accused of $60 million cybercrime,7
1055,2016-01-08,Four-year storage of data deterring some households from filling out forms,3
1051,2016-01-08,"Koch Brothers pressured to back Trump by Big Donors in their Political Network, refuse to do so",2
1079,2016-01-08,Pope Francis defends Muslims and blasts 'Islam is NOT terrorism',2
1050,2016-01-08,Time Tested Techniques For Effective Weight-Loss,1
1052,2016-01-08,Your Path To Weight Loss Success Begins Right Here,1
1054,2016-01-08,Usage These Tips To Get The Awesome Body You Have Actually Been Waiting For,1
1057,2016-01-08,BRIC Diagnostic Imaging Equipment Market worth $7.6 Billion by 2018,1
1060,2016-01-08,Palestinian father sends his young child to throw rocks at Israeli soldiers. The father yells at the soldiers to shoot the child so that it could be captured on video. Watch how the soldiers respond instead.,1
1061,2016-01-08,The IOC's True Ideals: Corruption and Greed,1
1062,2016-01-08,"Pope: This is war, but not a war of religions",1
1065,2016-01-08,Japan DeNA unveils first driverless robot bus,1
1066,2016-01-08,Kris Meeke wins Rally Finland on cin news,1
1067,2016-01-08,Advanced Approaches to Successful Affiliate Marketing,1
1070,2016-01-08,Britney Spears Doesn’t Remember Meeting Taylor Swift But the Internet Found Proof,1
1071,2016-01-08,﻿Odell Beckham Jr,1
1074,2016-01-08,"Do you still hate ICE BUCKET CHALLENGE? I actually always hated, not now!",1
1075,2016-01-08,A defendant was sent to court without pants and this judge flipped out,1
1076,2016-01-08,Kris Meeke wins Rally Finland on cin news,1
1077,2016-01-08,Search Engine Optimization: A Helpful Tool For Your Business,1
1080,2016-01-08,12-15 best free Android apps of 2016,1
1081,2016-01-08,WOW! US Marine And Navy Veteran Writes BLISTERING Open Letter To Khizr Khan: “Does it matter whether Mr. Trump has ‘sacrificed’? Has Ms. Clinton ‘sacrificed’ for this nation? How about Mr. Obama?”,1
1082,2016-01-08,The Sagamihara Tragedy Deepens,1
1083,2016-01-08,"India: woman dragged out of office, raped in Muktsar",1
1084,2016-01-08,Oklahoma City Thunder gain roster versatility by signing veteran combo-guard Ronnie Price to multi year deal.,1
1058,2016-01-08,Anti-aging Tips That Cost Pennies Per Day,0
1069,2016-01-08,ISIS slam pope with paedophilia suspicions,0
1072,2016-01-08,"Pakistan will be made secure for every race, religion, ethnicity: PM Nawaz Sharif",0
2958,2016-01-11,China's New Stealth Jet Looks Suspiciously Familiar,63
2966,2016-01-11,Japan repeats history with record-breaking Maglev train,59
2969,2016-01-11,Payback Time: Militias Betrayed By ISIS in Mosul Say They Too Will Have Revenge,38
2972,2016-01-11,"North Korea preparing for another ballistic missile launch, sources say",29
2968,2016-01-11,What is Standing Rock and why are 1.4m 'checking in' there? - BBC News,7
2955,2016-01-11,Russian dissident Ildar Dadin accuses prison staff of torture,3
2973,2016-01-11,Jailed ex-Brazil Congress leader may not get to tell all,3
2947,2016-01-11,Russia activist Ildar Dadin accuses prison of torture,2
2940,2016-01-11,[Music] Tekno – Yemi Alade – Pana Remix,1
2941,2016-01-11,Now THIS Is A Fashion Shoot That's Actually Inclusive,1
2942,2016-01-11,Music Download: Genesis – Baakor (feat. Ennwai) (Prod. By Robby Beatz),1
2943,2016-01-11,@Blogmarketing_L : https://t.co/G8XBrY34AC - The Miracle Farm - This Offer Will Drop Like A Bomb! Insane Cr!,1
2945,2016-01-11,Meet The Doctor Behind The Most Extreme Face Transplant Ever,1
2946,2016-01-11,Gimlet’s 'StartUp' Podcast Picks Controversial Character In Dov Charney,1
2948,2016-01-11,The speaker of the Russian parliament's upper chamber says Moscow isn't going to give up any of the disputed Pacific Ocean islands to Japan,1
2949,2016-01-11,"Flying cars are a possibility, Uber says",1
2950,2016-01-11,"Many congratulations — JOG10, Christina Day, Dennis McNally, S.J., Andrew Pinkham, Robert Cenedella and The Rail Park! Plus, a great opportunity and lots of Pictures!",1
2951,2016-01-11,Republican Congressman: The Best Reason To Vote For My Opponent Is He Has A Hot Wife,1
2952,2016-01-11,Stunning Beach Photos Celebrate Kids With Down Syndrome,1
2953,2016-01-11,Eatery Makes Delicious Meals From Food That Stores Refuse To Sell,1
2954,2016-01-11,WATCH: Ice Prince – Trillions (Feat. Phyno) (Official Video),1
2956,2016-01-11,@ka_kameliatod : https://t.co/8XcYAfZ8f4 - New Blockbuster From Dr. Joe Vitale!,1
2957,2016-01-11,Prashant Kishor meets Mulayam,1
2959,2016-01-11,EXPLOSION AT PAKISTAN SHIP BREAKING YARD KILLS 11 WORKERS,1
2960,2016-01-11,Wall Street Extends Losses On Election Jitters,1
2961,2016-01-11,GOP Pins Its Dwindling Senate Hopes On The FBI,1
2962,2016-01-11,Shirtless James Franco Praises Hillary Clinton In Second Endorsement Video,1
2963,2016-01-11,What The World Finds Scariest About Donald Trump,1
2964,2016-01-11,SurkovLeaks: 1GB mail cache retrieved by Ukrainian hacktivists,1
2965,2016-01-11,মিরাজের অজানা কাহিনী ! ১২ বছরে দল থেকে বাদ পরেছিলেন !! Bangladesh Cricket News,1
2967,2016-01-11,"Привет, чем занимаешься? .. Сижу, жру",1
2970,2016-01-11,October surprise: Does it ever swing a US election?,1
2971,2016-01-11,{{Fox TV}} Cubs vs. Indians Live Stream: Game 6 World Series 2016,1
2974,2016-01-11,Creepy satellite image of Hurricane Matthew looks like grinning skull,1
2944,2016-01-11,New film displays Germans in best and worst light in refugee crisis,0
24,2016-02-07,"Brazilian authorities dismantle the country’s largest illegal logging syndicate, responsible for over US$94 million worth of environmental damages.",1553
21,2016-02-07,"Man hacked to death while picking flowers for morning prayers: A Hindu temple worker was hacked to death in southwest Bangladesh early Friday in the latest attack blamed on radical Islamists, police said.",388
28,2016-02-07,Germany Puts Migration-Related Costs at Over $86 Billion Over Next Four Years - WSJ,32
17,2016-02-07,F.B.I. Interviews Hillary Clinton Over Private Email Server,31
10,2016-02-07,FBI Grill Hillary Clinton On Emails For Hours,17
16,2016-02-07,"Venezuelan ruling party, allies studying measure to dissolve opposition-led Congress",16
9,2016-02-07,Juno mission: British rocket engine ready for Jupiter task - BBC News,12
2,2016-02-07,"EU migration to Germany hits record high as 685,000 Romanians, Poles and Bulgarian flock to the country in a year.",11
26,2016-02-07,Third of Russians Expect Rigged 2016 Duma Elections,9
8,2016-02-07,"Hillary Clinton Gives Interview to FBI About Emails, Campaign Says",8
15,2016-02-07,Stephen Hawking’s Stalker Found Guilty Of Sending Death Threats To The Scientist,8
33,2016-02-07,How IS terrorists used social media for 'updates' on Dhaka cafe attack,8
5,2016-02-07,Hole in the ozone layer is finally 'healing' - Science News,6
11,2016-02-07,French citizenship to become more accessible,5
14,2016-02-07,"Turkey nabs 20 suspects in connection with Ataturk attack, Erdogan says",5
32,2016-02-07,"After shooting a Palestinian with Down syndrome, Israeli soldiers fled without looking back",5
20,2016-02-07,Thirty killed in Syrian strikes on Damascan suburb town: monitor,3
34,2016-02-07,Brazilian authorities dismantle the country’s largest illegal logging ring as part of a three year long criminal investigation.,2
0,2016-02-07,Al Qaeda Leader Warns Boston Marathon Bomber Execution,1
1,2016-02-07,Catnip to be banned in legal high crackdown,1
3,2016-02-07,Step-By-Step Fast Programs In Teeth Whitening,1
4,2016-02-07,http://hourofmiraclestv.podomatic.com/entry/2013-07-02T08_29_11-07_00,1
6,2016-02-07,Bangladesh siege: Twenty killed at Holey Artisan Bakery in Dhaka,1
12,2016-02-07,Mideast mediators questions Israel's commitment to 2 states,1
18,2016-02-07,Losses for Government in Australia Election Could Threaten Its Majority,1
19,2016-02-07,"Information About Varsity Admission, Exam resources, Scholarship with Sports",1
22,2016-02-07,UN rights council condemns the disruption of internet access,1
23,2016-02-07,Syrian Opposition Forces Seize Over Villages In Aleppo Countryside … Casualties In Salah Al-Deen Neighborhood,1
25,2016-02-07,"Quantenheilung Muskeln, Sehnen, Wirbelsäule",1
27,2016-02-07,Russian court convicts man of ‘falsifying history’ for saying the USSR shares responsibility for starting WWII,1
30,2016-02-07,What sort of Recruitment Company Performs,1
31,2016-02-07,The Latest: US citizen among the victims in the Dhaka siege,1
7,2016-02-07,Muslim man hospitalized after panicked police follow up false claim that he pledged allegiance to ISIS,0
13,2016-02-07,Jean-Claude Juncker the boozy bully who sums up all that's rotten about the EU,0
29,2016-02-07,"Dhaka attack: Islamic State claims attack, releases pictures of five attackers, you will be shocked to know how young they were",0
1104,2016-02-08,70% of ISIS militants in Afghanistan are Pakistani Taliban: Nicholson,621
1113,2016-02-08,"Judge blasts FBI for bugging courthouse, throws out 200 hours of recordings",50
1110,2016-02-08,"Rio Waters: ""There's no real way to sugar-coat it: The biggest problem with the water is that it's filled with poop.""",48
1118,2016-02-08,China's companies Has $1 Trillion in Cash That It’s Too Scared to Spend,26
1109,2016-02-08,Japan Plans $61 Billion Infrastructure Spending to Boost Economy,20
1111,2016-02-08,Chinese Furniture Fashion Ravages West Africa’s Savannas,12
1117,2016-02-08,Barack Obama says Donald Trump is 'woefully' unfit to serve as president,9
1105,2016-02-08,Man charged with sexually touching sleeping Virgin America passenger,8
1103,2016-02-08,Cuba battles lung cancer with its own vaccine,7
1100,2016-02-08,"Snapping up cheap spy tools, nations 'monitoring everyone'",4
1088,2016-02-08,Fighting continues in South Sudan,2
1095,2016-02-08,"The mother of a British man accused of trying to assassinate Donald Trump said Tuesday her son had ""a lifetime of mental health problems"" and was on suicide watch in a Nevada jail.",2
1098,2016-02-08,Now battery status can be used to track you online,2
1085,2016-02-08,WikiLeaks Founder Shuts Down Democrats’ Claims About Emails,1
1086,2016-02-08,“Hot Lesbian” Ad Gets Canadian Oil Sands More Publicity Than It Deserves,1
1089,2016-02-08,Android 7.0 Nougat could arrive August 5,1
1091,2016-02-08,ΤΣΑΚΙΣΜΑ ΕΔΩ ΚΑΙ ΤΩΡΑ ΤΩΝ ΝΤΑΒΑΤΖΗΔΩΝ!,1
1092,2016-02-08,This woman was not jailed despite admitting getting a boy to tie her up and hit her genitals - when she was a man. So had she been a man still would it have been different...????,1
1093,2016-02-08,Altındağ Temizlik Firmaları,1
1094,2016-02-08,"UN asks Saudis to address ‘serious concerns’ about child deaths in Yemen. In the letter, Saudi Ambassador Abdallah al-Mouallimi offered to share with the United Nations the results of 10 investigations of air strikes on hospitals, homes, a wedding party and markets.",1
1096,2016-02-08,"Crude Oil May Rebound to $57 Next Year, Analysts Say",1
1097,2016-02-08,Things To Keep In Mind When Dealing With Lawyers,1
1099,2016-02-08,Hero SAS sniper saves hundreds of lives by killing ISIS suicide bomber with just one shot,1
1101,2016-02-08,"Britney Spears Might Be Ready to Find Love Again, Despite History of ''Horrible Relationships''",1
1102,2016-02-08,There’s Little Proof That Flossing Actually Works,1
1106,2016-02-08,Need Help With Home Improvement? Check Out These Top Tips!,1
1107,2016-02-08,৪ বছরের শিশু দেখতে ৮০ বছরের বৃদ্ধের মতো,1
1108,2016-02-08,"Economists tell Sri Lanka president, finance minister, their policies inconsistent",1
1112,2016-02-08,Woman leads police on wild chase on cin news,1
1114,2016-02-08,Garcinia Cambogia - Can This Fruit Help You Lose dietary?,1
1115,2016-02-08,اخر الاخبار من القنوات الاخبارية المختلفة,1
1087,2016-02-08,Five dead as Russian aid helicopter is blasted out of the sky over Syria,0
1090,2016-02-08,Swede suffers shrinking penis after dentist fits mouthguard,0
1116,2016-02-08,Pokemon Go Server Status up or Down,0
1119,2016-02-08,"Instagram launches a new feature called Instagram stories, Similar to snap-chat.",0
1823,2016-02-09,Jackie Chan to receive lifetime achievement Oscar,43
1837,2016-02-09,"China, US set to release review of each other’s fossil fuel subsidies in historic move at G20 summit | The cross-checking system between world’s two worst carbon polluters will be the first time Beijing has allowed another nation to review its domestic energy subsidies",40
1830,2016-02-09,A new report predicts the world's population is growing faster than we thought,22
1848,2016-02-09,Australian cops ‘will die in jail’ for cold-blooded drug deal murder of Chinese student with alleged links to Hong Kong triads | Former ­detectives Roger Rogerson and Glen McNamara sentenced to life without ­parole for the “heinous” killing of 20-year-old business student Jamie Gao,9
1850,2016-02-09,Turkey pushes west in offensive against Islamic State in Syria,9
1827,2016-02-09,Singapore should brace for long-term battle with Zika - experts,7
1834,2016-02-09,"Uh, Syria Is Trying To Sell Itself As A Vacation Paradise",7
1825,2016-02-09,Brazil may grow 2.5 percent in 2018: finance minister,6
1829,2016-02-09,Brazil's Supreme Court urged to bar Rousseff from politics,5
1842,2016-02-09,Charlie Hebdo Italy earthquake cartoon sparks anger - BBC News,4
1826,2016-02-09,Uzbekistan’s President Islam Karimov Dies,3
1846,2016-02-09,China is investigating Uber’s sale to rival Didi over antitrust concerns,3
1847,2016-02-09,Copenhagen cannabis market torn down after shooting,3
1853,2016-02-09,Germany's Gabriel to meet Putin soon: source,3
1844,2016-02-09,"In vigil for drowned Syrian boy, Britain urged to take in 400 children from Calais camp",2
1852,2016-02-09,EU rebuffs Vestager predecessor's criticism of Apple move,2
1820,2016-02-09,"Explosion in night market in the Philippines killed 10, injured 60",1
1821,2016-02-09,﻿Hat Dance Group ⋆ Szkoła Tańca Warszawa,1
1822,2016-02-09,"As a candidate, Trump has already embarrassed us on the world stage. Imagine the damage he'd do as president.",1
1824,2016-02-09,الطائر الروسي الجديد “بريمير” يستعرض مهارتة,1
1828,2016-02-09,China Switching Power Supply Manufacturers and Suppliers,1
1831,2016-02-09,Samsung is recalling the Galaxy Note 7 worldwide over battery problem,1
1832,2016-02-09,"Germany, in gesture to Turkey, says Armenia resolution not binding",1
1833,2016-02-09,Pass the Bar Exposed,1
1835,2016-02-09,"Breaking: 10 dead, scores hurt as blast rocks Philippine presidentâs home city",1
1836,2016-02-09,Australia Will Legalize Medicinal Cannabis In November,1
1838,2016-02-09,Women’s I Look Good at 60 Born on 1956 60th Birthday Gift T-Shirt XL Black Review,1
1840,2016-02-09,“حافظة نقود” تقلب حياة مشرد رأس على عقب,1
1841,2016-02-09,Ed Javius Instructional Strategies Reflection,1
1843,2016-02-09,New Article Reveals the Low Down on Lsat Test Cost and Why You Must Take Action Today,1
1845,2016-02-09,Lose Weight With Herbal Treatment,1
1849,2016-02-09,Japanese reporter thinks something strange is afoot with Putin’s schedule,1
1851,2016-02-09,القمة والقامة والقيمة.. تجتمع في ألبوم “محمد عبده” الجديد,1
1854,2016-02-09,Advice To Aid You Handle Your Finances,1
1839,2016-02-09,"Philippines explosion: 12 dead, 60 injured in Davao City market blast",0
3005,2016-02-11,"Woman gives birth in car, hospital charges full delivery fee",26
3000,2016-02-11,Korean Coast Guard opens fire at illegal Chinese fishing boats,21
2996,2016-02-11,IS chief Baghdadi surrounded by Iraqi Army inside Mosul,11
2998,2016-02-11,WAR ON THE STREETS OF PARIS: Armed migrants fight running battles in the French capital,10
2980,2016-02-11,Israel advances construction of 181 homes in east Jerusalem,6
2976,2016-02-11,How the US election will change Australia (with a beautiful new UX design for reading news),2
3001,2016-02-11,Amnesty staff blocked from Moscow office after officials seal premises,2
2975,2016-02-11,Pakistan Man kills 12-year-old daughter for her bad cooking,1
2977,2016-02-11,"Qué pasa con la persona adicta?, cómo la podemos ayudar?",1
2978,2016-02-11,#CokeStudioGhana: Stonebwoy returns in Episode 5,1
2979,2016-02-11,@Blogmarketing_L : https://t.co/t4VBMoKBmG - Explore Revelation,1
2981,2016-02-11,Hoax Alert: Cosmic Rays from Mars Entering Earth,1
2982,2016-02-11,"Facebook Censors Caravaggio’s Nude Cupid, Then Changes Mind",1
2983,2016-02-11,Afghan Children Return Home From Pakistan To Lives Marked By Forced Labor,1
2984,2016-02-11,Taylor Swift Is The Highest-Paid Woman In Music For 2016,1
2985,2016-02-11,'Complete Idiots' Who Stood On Turtle's Back Could Face Huge Fine,1
2986,2016-02-11,This app lets you listen and share your baby's heartbeat before it's born,1
2987,2016-02-11,Court questions Karnataka’s move to celebrate Tipu Jayanti,1
2989,2016-02-11,7 cách khởi nghiệp kinh doanh với số vốn nhỏ dưới 10 triệu đồng,1
2990,2016-02-11,OMG!! THIS IS THE BEST TRUMP VIDEO YOU WILL EVER SEE!!! AMAZING!!!!,1
2991,2016-02-11,Which Ronda Rousey shows at UFC 207? That’s a good question…,1
2992,2016-02-11,beauty,1
2993,2016-02-11,Ruh Lagu Nike Ardilla Hidup di Lagu Serenade Rindu Milik Tawmasy Band,1
2994,2016-02-11,Here's What You Should Know About The Dakota Pipeline Protest,1
2995,2016-02-11,"Best Wine Aerator Decanter for Red Wine, Unique Gift Idea For Women, Men, Her, Him, Anniversary, Birthday, Christmas, Couples, Friendship, Wine Gift, Compare to Vinturi Brand Review",1
2997,2016-02-11,Microsoft: Hackers try to exploit Windows bug,1
2999,2016-02-11,Baghdad Bombing Something Strange Happened,1
3002,2016-02-11,@ralicap1 : https://t.co/c6TtzLSKJP - Worlds Most Powerful Software To Develop &amp; Simulate Roulette Systems!,1
3003,2016-02-11,One of my biggest regrets is not getting married before fame-Iyanya,1
3004,2016-02-11,Career Counselling: Why it helps to speak with a professional,1
3006,2016-02-11,Pro-Trump Group Racks Up Volunteer 'Poll Watchers' Even As Lawsuits Allege Voter Intimidation,1
3007,2016-02-11,Actress Eva Amurri Martino Shares Home Birth Story Through Intimate Photos,1
3008,2016-02-11,"Joe Biden: 'If You're Smart,' You'd Be A Feminist",1
3009,2016-02-11,Librarian Launches Subscription Box To Celebrate Black Authors,1
2988,2016-02-11,"Former UN Under-Secretary-General Shashi Tharoor wants the British PM to apologise to India for ""colonial injustices"" and loot estimated to be $3 trillion in today’s times",0
3640,2016-02-12,Venezuela's currency value depends largely on one guy at an Alabama Home Depot,1391
3670,2016-02-12,Denmark deports woman for begging for the first time: Court sentences woman to 40 days in prison before she is expelled from the country,407
3669,2016-02-12,Internet Archive Successfully Fends Off Secret FBI Order,141
3658,2016-02-12,Gambian president said he would rule for a ‘billion years.’ He just lost reelection.,105
3650,2016-02-12,A Milwaukee police sergeant who served jail time for letting his 13-year-old daughter drive and driving drunk himself with the child in his car is up for promotion to lieutenant.,57
3660,2016-02-12,"China's top graft-buster tells party members to stop believing in ""ghosts and supernatural beings""",43
3647,2016-02-12,Hackers Steal $31 Million From Accounts at Russian Central Bank,35
3655,2016-02-12,Aide: Trump invited Philippine leader to WH,31
3672,2016-02-12,Donald Trump’s breezy calls to controversial foreign leaders leave diplomats aghast,15
3663,2016-02-12,Philippines' Duterte gets Trump invite during 'animated' call: aide,14
3642,2016-02-12,Prostitution research to assess law change call - BBC News,9
3671,2016-02-12,"Nearly 2,000 Iraqi troops were killed across Iraq in the month of November, according to newly released UN figures, as they battle to force ISIS extremists from the country.",9
3651,2016-02-12,New UN sanctions to cost North Korea $800 million every year after recent nuclear test,6
3667,2016-02-12,Saudi Woman Who Went To Breakfast Without Wearing Hijab Faces Calls For Her Execution,6
3652,2016-02-12,Venezuela's currency value depends largely on one guy at an Alabama Home Depot,2
3666,2016-02-12,Senate Responds to Post-Trump Anti-Semitism By Targeting Students Who Criticize Israel,2
3641,2016-02-12,@Blogmarketing_L : https://t.co/roYto5yWxb - Periscope Profit Machine,1
3643,2016-02-12,"on,Dakika,Şanlıurfa,haberleri,Urfa, Gündemi, Sanliurfa.com,urfa.com,haberler.com,Urfada,haber,",1
3644,2016-02-12,TOP 10 BEST POWER WHEELS FOR GRASS,1
3645,2016-02-12,Heavy rains kill 32 ISIS as Hashd prepare to storm Tal Abta,1
3646,2016-02-12,Four robbers arrested after gunfight,1
3648,2016-02-12,@Blogmarketing_L : https://t.co/8XzZW2lBIf - Chega De Diabetes. 90% Comiss├Бo.,1
3649,2016-02-12,الرئيس الأمريكى دونالد ترامب أغنى من دولة بكاملها !!,1
3653,2016-02-12,جديد http://bit.ly/2g0Gin0 http://bit.ly/2gIjzdL http://bit.ly/2g0Grqq … … … … … … http://bit.ly/2gIjBlT http://bit.ly/2g0HsiB,1
3654,2016-02-12,"‘Kahaani 2’ Will break your heart, grip your senses (Film Review)",1
3656,2016-02-12,@ka_kameliatod : https://t.co/FF3JVmjDSW - Eckbank Und K├╝chenessecke Technik,1
3657,2016-02-12,Court Orders MTN To Pay 63 Sacked Staff 4yrs Salary and Post-Disengagement Benefits,1
3659,2016-02-12,Britney Spears' Music Video Orgies Ranked From Best To Iconic,1
3661,2016-02-12,"Isis sending operatives to Europe, warns Europol",1
3662,2016-02-12,Magnus Carlsen clinches third consecutive World Chess Championship!,1
3664,2016-02-12,Real Madrid must win La Liga and end Barca dominance - Roberto Carlos,1
3665,2016-02-12,"N. Korea carries out simulated attack on neighbors, South imposes new sanctions",1
3668,2016-02-12,@ralicap1 : https://t.co/tvwrKNbFKo - Seduction Genie - How To Attract Men For Women,1
3673,2016-02-12,Minimally invasive surgery in Delhi,1
3674,2016-02-12,"Lydia Forson is just a fake person who can write good English, says A Plus",1
69,2016-03-07,Malaysia: 76-yr-old man held for insulting PM Najib Razak on WhatsApp,396
59,2016-03-07,"Google Plugs Into Japan With Its Own Undersea Cable - It’s the fastest, highest capacity trans-Pacific undersea cable ever built. It can theoretically deliver as much as 60 terabits per second of bandwidth.",298
66,2016-03-07,Big Beef is Hiring Hitmen to Murder Activists — 185 Murders Last Year Alone,71
38,2016-03-07,From Elite Schools To ISIS? Mystery Of Dhaka Attackers,43
58,2016-03-07,Romania Seizes Record Cocaine Load Worth Over 600 Million Euros.,26
52,2016-03-07,43 killed in Syria government air strikes near Damascus,21
61,2016-03-07,"Hamas leader threatens next Gaza war will be the last: Haniyeh denies any ‘media statements’ about next conflict, though remarks were reportedly made in a mosque speech.",13
35,2016-03-07,"Pope Benedict Dishes on Vatican’s ‘Powerful Gay Lobby’: Pope Benedict is destroying the diary he kept as pope, but not before releasing his tell-all memoir.",7
62,2016-03-07,"Restore EU trust with pragmatism, urges Germany's Schäuble",5
57,2016-03-07,Controlled explosion at Stade de France hours before Euro 2016 quarter final due as police blow open the door of an illegally parked car outside the stadium,4
46,2016-03-07,Police carry out controlled explosion outside Stade de France ahead of France-Iceland match,3
47,2016-03-07,"Youth slits girl's throat for rejecting his marriage proposal in Telengana, India",2
49,2016-03-07,"Baghdad bombing: Casualties in Karrada rise to 167 dead with 180 injured, expected to rise.",2
36,2016-03-07,Donald Trump’s ‘Star of David’ Tweet Previously Appeared on Racist Website,1
37,2016-03-07,Income Inequality Is at the Highest Level in American History,1
39,2016-03-07,Facebook wants Mobile App Startups to apply in their FbStart program,1
40,2016-03-07,Bernie Sanders: Democrats Need to Wake Up,1
41,2016-03-07,Keeping Your Battery Clean Makes Your Vehicle Safe,1
43,2016-03-07,Central Park explosion injures 1,1
44,2016-03-07,Explosion in Central Park,1
45,2016-03-07,Blac Chyna &amp; Rob Kardashian Are Overjoyed to Feel Their Baby Move,1
50,2016-03-07,VIDEO: Syrian Army Troops Impose Heavy Losses on Al-Nusra Militants in Dara’a,1
53,2016-03-07,"At least 30 dead, dozens missing as flood wreaks havoc in Northern Pakistan",1
54,2016-03-07,How Long You Have To Wait For Fully Self-Driving Car?,1
55,2016-03-07,Plumbing Advice That Everyone Should Know About,1
56,2016-03-07,"Niger Delta Avengers announce fresh attack on NNPC, Chevron fercilities",1
