,date,title,score
548,2016-07-17,2 years later: Video shows the moment Russian-backed rebels realized they shot down a civilian airliner in eastern Ukraine,3
525,2016-07-17,Baton Rouge shooting: At least three police officers dead,1
526,2016-07-17,"Three police officers killed in Baton Rouge shooting, others injured",1
528,2016-07-17,Tips to Consider Before Purchasing A Castiron Waffle Maker,1
530,2016-07-17,"►Top 12 Selfie Moment of Pakistani Actress ""Qandeel Baloch"" || You can n...",1
531,2016-07-17,3 law enforcement officers killed in shooting in Baton Rouge,1
534,2016-07-17,"iPhone 6 Case, 6S Gradient Color Mirror Soft TPU Case with Shockproof PC Bumper for Apple iPhone 6S,iPhone 6S Case (Purple)",1
536,2016-07-17,Baton Rouge | Baton Rouge police shooting,1
537,2016-07-17,France calls up 12K police reserves to beef up security,1
539,2016-07-17,videos for whatsapp Qandeel Baloch last message for womens in twitter,1
541,2016-07-17,I Graduated From The Streets T-Shirts/Hoodies,1
542,2016-07-17,Five casualties after helicopter crash,1
544,2016-07-17,Greece charges Turkish officers fleeing after failed coup on President Recep Tayyip Erdogan,1
545,2016-07-17,"A conservation group has created 3-D printed sea turtle eggs containing GPS trackers. The eggs are set to be deployed this fall in Central America during an arribada,or mass nesting event when 90 percent of eggs will be poached from certain beaches.",1
546,2016-07-17,Online Homework Help,1
547,2016-07-17,"A conservation group has created 3-D printed sea turtle eggs containing GPS trackers. The eggs are set to be deployed this fall in Central America during an arribada,or mass nesting event when 90 percent of eggs will be poached from certain beaches.",1
549,2016-07-17,How to turn your laptop into a wifi hotspot,1
550,2016-07-17,Read through by means of This Publishing In progress of Investing In Major Estate,1
551,2016-07-17,Alden Ehrenreich Confirmed as New Han Solo in Star Wars Standalone Film,1
552,2016-07-17,World news in one minute July 17 2016,1
556,2016-07-17,"Two IDF soldiers killed by grenade - one American, one Druze",1
557,2016-07-17,Let's Do Away With These 5 Body Shaming Remarks,1
559,2016-07-17,Wonderful Guidance That Will Aid You Appreciate The Journey,1
538,2016-07-17,Turkey’s religious groups denounce coup attempt,0
553,2016-07-17,The link between Brexit and the death penalty,0
555,2016-07-17,"A Palestinian village under siege: No one can leave, not even a child with cerebral palsy",0
581,2016-07-18,Turkey suspends leave for over 3 million civil servants: Gov't order,86
594,2016-07-18,"NATO, US, EU warn Turkey on coup crackdown",57
583,2016-07-18,Tension rises in eastern Turkish province amid reports of march on Alevi neighborhoods,34
591,2016-07-18,All Russian Teams Face Ban From Rio Olympics,24
574,2016-07-18,Turkish Police Raid Incirlik Airbase,20
567,2016-07-18,AP Exclusive: Secret document lifts Iran nuke constraints,16
570,2016-07-18,AP: Secret Document Lifts Iran Nuke Constraints,9
561,2016-07-18,AP Exclusive: Secret Document Lifts Iran Nuke Constraints,8
568,2016-07-18,Turkey coup attempt: Confusion over general's 'confession'.,8
588,2016-07-18,WikiLeaks says to release documents on Turkey’s power structure,8
584,2016-07-18,People in Nice are throwing trash on the spot where the attacker died,7
586,2016-07-18,Turkish Prosecutors Raid Incirlik Airbase Housing US Warplanes And 50 Nuclear Bombs,7
562,2016-07-18,Japan's Son chased $32 billion ARM deal by the sea in Turkey,6
563,2016-07-18,AP Exclusive: Secret document lifts Iran nuke constraints,6
578,2016-07-18,EU warns Turkey's president Erdogan not to abandon 'rule of law' after failed coup,6
564,2016-07-18,China Faces More Air Pollution Deaths,5
565,2016-07-18,"French PM Manuel Valls Booed at Nice, France Memorial",4
566,2016-07-18,Document obtained by AP: Secret deal will allow Iran to expand key nuclear program in little more than a decade,3
587,2016-07-18,"Iran hardliners make gains, trouble for Rouhani",3
560,2016-07-18,Bulgaria files charges against two Hezbollah-linked suspects over 2012 bombing of Israeli tourists,1
571,2016-07-18,"4 Kenyan Policemen Charged in Deaths of Lawyer, Client and Driver",1
572,2016-07-18,Moment of Silence for Nice Victims,1
573,2016-07-18,Applebees Salad Calories,1
575,2016-07-18,Mr. Bean Actor And Known Car Guy Rowan Atkinson Is Not Actually Dead,1
576,2016-07-18,India's interests would be better served by developing a series of solar power plants in Bangladesh,1
579,2016-07-18,Here’s When Game of Thrones Season 7 Will Premiere,1
580,2016-07-18,Cell Culture Market - Forecast to 2020,1
582,2016-07-18,India is blinding young Kashmiri protesters,1
585,2016-07-18,นำเสนอเว็บไซต์จัดจำหน่ายเตียงเด็ก ที่นอนเด็ก ของใช้เด็กเล็ก เปลเด็กคุณภาพดี ราคาถูกกว่าที่อื่น,1
589,2016-07-18,Germany To Require 'Black Box' in Autonomous Cars,1
590,2016-07-18,Recep Tayyip Erdogan supporters demand return of death penalty,1
592,2016-07-18,JESUS IS THE ANSWER FOR THE WORLD TODAY. MATTHEW 11,1
593,2016-07-18,"In Istanbul, Optimism Masks a Familiar Melancholy",1
569,2016-07-18,Secret deal will allow Iran to expand its nuclear program in little over a decade,0
577,2016-07-18,Pokemon Go: Sex offender caught playing game with child,0
604,2016-07-19,Boris Johnson grilled over past ‘outright lies’ at uneasy press conference. Foreign secretary endures awkward outing as reporters repeatedly press him to explain previous insults about world leaders.,819
603,2016-07-19,State media: Turkey sends formal request for extradition of Gulen from U.S.,346
623,2016-07-19,"Paris airport shuttle driver with known radical links arrested ,explosives found",153
628,2016-07-19,"Soaring Temperatures Will Make It Too Hot to Work, UN Warns",33
621,2016-07-19,"Indefinite Blackout Ordered For WhatsApp in Brazil, Again.",16
595,2016-07-19,Woman and girls stabbed 'for wearing shorts and T-shirts' at Alps resort,11
609,2016-07-19,Brazilian extremist group uses Telegram to pledge allegiance to ISIS ahead of Olympics,10
622,2016-07-19,Russia to sell nuclear fuel to US,8
599,2016-07-19,Facebook under fire for 'censoring' Kashmir-related posts and accounts,5
605,2016-07-19,"Billy Name, photographer at Andy Warhol's Factory, dies aged 76",3
613,2016-07-19,"Volkswagen Is Accused of Emissions Fraud as New York and Massachusetts Sue, Naming Names",3
611,2016-07-19,"A Third of Nice Truck Attack’s Dead Were Muslim, Group Says",2
596,2016-07-19,Live updates from the 2016 Republican National Convention,1
597,2016-07-19,"Gunman stalked Baton Rouge officers before shooting, police say",1
598,2016-07-19,Blac Chyna's Baby Bump Is Growing: See How Big It's Getting in One GIF,1
600,2016-07-19,The *Official AndreasCY* - What's New #3,1
601,2016-07-19,"ΈΚΤΑΚΤΟ ΚΑΙ ΕΠΕΊΓΟΝ ... για τη δίκη της Χρυσής Αυγής (οι κατήγοροι τρεχουν να βρουν τρυπες να χωθούν) Ο κολλητός του Παύλου Φύσσα Νίκος Χατζηευστρατίου, έ...",1
602,2016-07-19,guy dodges two tanks during the coup in turkey,1
606,2016-07-19,"Floureon Universal Motorcycle Cell Phone Mount Holder USB Charger for iPhone,GPS with 3.5-6 Inches",1
607,2016-07-19,How To Do Home Improvements For A Better Life,1
608,2016-07-19,Are There Any Creams For removing Dry templates?,1
610,2016-07-19,Advice For Getting The Most Out Of Your Garden,1
612,2016-07-19,"After Germany axe attack of ISIS flag owning Afghan, a politician from Germany's Green Party provoked anger when she asked in a Tweet: ""Why couldn't the attacker be non-fatally shot???? Questions!""",1
614,2016-07-19,Skyscrapers’ Rise in China Mark the Fall of Immigrant Enclaves,1
615,2016-07-19,"In Death, Qandeel Baloch, Pakistani Social Media Star, Is Celebrated as a Feminist Hero",1
616,2016-07-19,Proper Way Of Using Dhc Skin Care Products,1
618,2016-07-19,"Vivid, Gorgeous Shade Tolerant Annuals",1
619,2016-07-19,At least 15 civilian protesters were killed and more than 200 wounded in firing by the Indian armed forces-Kashmir,1
620,2016-07-19,Nigerian Man Builds Water-Powered Generator,1
624,2016-07-19,"Seeking to Improve Ties With Russia, Turkey Apologizes for Downing Warplane",1
625,2016-07-19,"A biotech startup has managed to 3-D print fake rhino horns that carry the same genetic fingerprint as the actual horn. The company plans to flood Chinese rhino horn market at one-eighth of the price of the original, undercutting the price poachers can get and forcing them out eventually.",1
626,2016-07-19,Gunman storms hotel in southern France,1
627,2016-07-19,Taylor Swift Exposed By Kim Kardashian On Snapchat! full,1
629,2016-07-19,Puppy Training Etobicoke,1
617,2016-07-19,A Welsh roof thatcher who is looking to collect blood to continue plying his trade,0
646,2016-07-20,Saudi revives 15-year-old anti-Pokemon fatwa,192
651,2016-07-20,"North Korea’s state radio resumes broadcast of indecipherable, coded numbers for first time since Cold War",81
644,2016-07-20,"Finland- Man Fights Off Three People Breaking Into His Home, Sentenced to Four Years in Prison and Forced to Pay Robbers 21,000€",51
634,2016-07-20,"Hungry Venezuelans cry at the sight of food, as economic crisis deepens",32
640,2016-07-20,Earth Just Experienced The Hottest June Ever Recorded,29
630,2016-07-20,Feds want 'Wolf of Wall Street' profits as part of $3.5 billion fraud allegations,25
660,2016-07-20,TASS: Erdogan said Turkey ready to restore regional peace together with Iran and Russia,19
659,2016-07-20,‘Graveyard for traitors’ to be built in Istanbul for coup plotters: Mayor,16
636,2016-07-20,"After 49 years, Israel renews ties with Guinea, a Muslim-majority African nation",11
642,2016-07-20,Brussels terrorist scare finished - suspicious person was student doing research,8
649,2016-07-20,Smokers fume as France mulls ban on 'too cool' Gitanes and Gauloises.,6
656,2016-07-20,PM May says wants to reduce migration into UK to 'tens of thousands',5
638,2016-07-20,India's Rohit Khandelwal wins Mr. World 2016,3
650,2016-07-20,Germans Calls for compulsory school Islam classes after axe attack,3
662,2016-07-20,"Afghan Axe Attacker Acted Alone, German Official Says | Federal Prosecutor takes over",3
632,2016-07-20,"Erdogan critics glad coup failed, fearful of backlash",2
635,2016-07-20,HSBC Bankers Are First Individuals Charged in U.S. Currency Case,2
637,2016-07-20,North Korea confirms it test-fired ballistic rockets,2
652,2016-07-20,Saudi Arabia revives ban on 'un-Islamic' Pokémon in response to app,2
631,2016-07-20,"Tampa Party Bus Rental - Party Bus Tampa, Tampa Bus Rental Service",1
633,2016-07-20,Shannen Doherty shaves her head Because Breast cancer battle - Blogvirals,1
639,2016-07-20,Thousands of Pakistanis protest Indian Kashmir killings,1
641,2016-07-20,Etobicoke Flowers,1
643,2016-07-20,Belgium police isolate suspicious man in central Brussels,1
647,2016-07-20,Musica MP3 No hay más de un misterio,1
648,2016-07-20,"Breaking: Capitalist Extremists Blow Up 85 Civilians In Syria, Including 11 Children",1
653,2016-07-20,"'M'sians defrauded on enormous scale, 1MDB funds used to pay gambling debts'",1
654,2016-07-20,"Members Of The KKK, Black Lives Matter And Westboro Baptist Church Reportedly Throwing Urine At Each Other Outside RNC",1
655,2016-07-20,Shaving start-up firm bought by Unilever,1
661,2016-07-20,"Donald Trump Claims Nomination, With Discord Clear but Family Cheering",1
664,2016-07-20,Watch Jimmy Fallon Hilariously Mock Donald Trump’s Convention Speech,1
645,2016-07-20,"Capitalist Extremists Blow Up 85 Civilians In Syria, Including 11 Children",0
657,2016-07-20,"BREAKING: Capitalist Extremists Blow Up 85 Civilians In Syria, Including 11 Children",0
658,2016-07-20,﻿Normal Hair Treatment Tips Handy For All Types Of Hair,0
663,2016-07-20,America wants to believe China canât innovate. Tech tells a different story,0
683,2016-07-21,"Prosecutor says killer of 84 in Nice, France, had accomplices and planned an attack for months",456
694,2016-07-21,US-Led Airstrikes Kill as Many Civilians as Nice Attack–but Get No Front-Page Headlines in Major US Papers,150
698,2016-07-21,Ahmadiyya Muslim minorities fleeing Pakistan and seeking asylum in Thailand,15
671,2016-07-21,"Lut Desert, the Hottest Spot on Earth, Inscribed on World Heritage List",11
690,2016-07-21,"British police investigating the attempted abduction of a serviceman from a Royal Air Force base in eastern England, said on Thursday they could not discount it being a terrorism incident.",10
681,2016-07-21,Cop shoots caretaker of autistic man playing in the street with a toy truck.,8
682,2016-07-21,Turkey coup attempt: Lives resume under state of emergency,8
665,2016-07-21,"Finland: Man Thrown in Prison For Using ""Excessive Self-Defense"" Against Home Invaders",6
678,2016-07-21,Security forces foil terrorist attacks in southeast Iran,6
697,2016-07-21,Egypt is investigating whether Pokemon Go is a threat to its national security,6
666,2016-07-21,Trump's NATO Rethink 'Would Endanger the Whole Alliance',2
679,2016-07-21,"Iraq heatwave sends temperatures up to 53°C. Iraq's summers are known for their merciless heat, but the government's chief weather forecaster Hassan Abdul Karim said this week's highs were well above average for this time of year.",2
667,2016-07-21,U.N. demands release of political prisoners in Congo,1
668,2016-07-21,Swedish Bus Driver Beats Up Muslim Migrant,1
669,2016-07-21,"Iraqis on Wednesday endured the hottest day so far this year, with temperatures soaring up to 51 degrees Celsius (124 Fahrenheit) in Baghdad and as much as 53 degrees Celsius (127 Fahrenheit) in the southern part of the country.",1
670,2016-07-21,Police arrest 10 suspected of planning terrorist acts during Olympics (Brazil),1
672,2016-07-21,Home Workouts For Men - information You require Know,1
674,2016-07-21,How To Win With Internet Marketing,1
676,2016-07-21,Fetullah Gülen Mısır'a sığınabilir iddiası,1
680,2016-07-21,Video shows Fethullah Gulen urging followers to secretly infiltrate Turkish state institutions,1
684,2016-07-21,Trembling tundra - the latest weird phenomenon in Siberia's land of craters,1
685,2016-07-21,"Attacker in Nice Plotted for Months and Had Accomplices, French Prosecutor Says",1
686,2016-07-21,Fast Easy Weight Loss Plans - Quick ideal Weight Loss,1
687,2016-07-21,Samsung president Lee Kunhee's prostitution videos leaked,1
688,2016-07-21,The First Live-Action Pokemon Movie Is Coming,1
689,2016-07-21,"Attacker in Nice, France, Had Support of Several People, French Prosecutors Say",1
691,2016-07-21,Brazil arrests 10 suspected ISIS members ‘planning Olympic terrorist attacks’,1
695,2016-07-21,The United States has taken innocent people’s life in Syria doubt of ISIS - Blogvirals,1
696,2016-07-21,﻿The Rise Of Virtual Accountant's,1
699,2016-07-21,Bring Your Rankings Up With These Search Engine Optimization Tips,1
673,2016-07-21,British Muslims recognised as the best charity givers,0
675,2016-07-21,Brazil arrests 'amateur' group accused of Olympics,0
677,2016-07-21,Video shows Fethullah Gulen urging his followers to secretly infiltrate Turkish state institutions,0
692,2016-07-21,Nations of the world confront the Pokemon menace - Times of India,0
693,2016-07-21,Saudi Arabia's clerics issue fatwa against Pokemon Go,0
724,2016-07-22,"Italy Considers Legalizing Cannabis, Could Become World Leader in Drug Law Reform",128
732,2016-07-22,Obama administration taken aback by Pakistan permitting Hafiz Saeed’s anti-India rally,25
734,2016-07-22,Turkey coup attempt: Detentions 'tip of the iceberg',22
725,2016-07-22,People flee Munich shopping centre amid gunshots- video,7
713,2016-07-22,Muslim man removed from American Airlines flight after attendant told him: 'I will be watching you',5
705,2016-07-22,Polish MPs adopt resolution calling 1940s massacre genocide,3
722,2016-07-22,Munich shopping centre shooting: At least three killed as major police operation continues,3
702,2016-07-22,"Munich shooter identified as Samuel Hydberg, a German nationalist, according to RT agency",2
714,2016-07-22,Reports of a second shooting at Marienplatz station,2
717,2016-07-22,"Several Dead, Injured After Shots Fired at Munich Shopping Center, German Police Say",2
726,2016-07-22,No veto on Brexit: Top UK legal head destroys Sturgeon &amp; says UK WON'T be held to ransom,2
700,2016-07-22,Winners and losers in Republican Convention,1
703,2016-07-22,WATCH LIVE: Shooting Spree in Shopping Mall in Munich Germany,1
704,2016-07-22,Suspects on the run after Munich shooting kills three,1
706,2016-07-22,﻿Love &amp; Relationships Websites Directory,1
707,2016-07-22,Britain's Johnson firm on NATO mutual defence after Trump remarks on cjn...,1
708,2016-07-22,Enhancing Your Life Through Home Improvement,1
709,2016-07-22,Easing Your Home Improvement Headaches,1
710,2016-07-22,What The World Needs To Know About Black Lives Matter,1
711,2016-07-22,ইউনেস্কো’র বিশ্ব ঐতিহ্যের নতুন তালিকা প্রকাশ,1
712,2016-07-22,"Trump's Ghost Writer of ""The Art of The Deal"" Tells All",1
715,2016-07-22,Munich shopping centre shooting: Live updates as,1
716,2016-07-22,Scott Cheever: Kansas Court Maintains Death Sentence Of Man Charged With Killing Sheriff,1
718,2016-07-22,Pictures of young drug dealers in Rio de Janeiro Favelas taken by an American journalist,1
719,2016-07-22,Sheremet Murder: New Footage Released,1
720,2016-07-22,“Promises From God for Women” Cards – A Box of Blessings Review,1
721,2016-07-22,Ex-Ku Klux Klan Leader David Duke Is Running for Senate in Louisiana,1
723,2016-07-22,Munich shooting: Several killed at shopping mall,1
727,2016-07-22,Shooting Taking Place At One of Munich's Largest Squares: Reports of a second shooting at Marienplatz station,1
730,2016-07-22,UEFA consider suspending Cristiano Ronaldo for his actions during Euro 2016 fina,1
733,2016-07-22,Trump speech enthuses Republicans on cjn news,1
701,2016-07-22,"ISIS is driven by Nationalism, NOT Religon",0
728,2016-07-22,Munich shopping centre evacuated after shooting,0
729,2016-07-22,Girl Reveals Snapchat Reality By Changing The Sense Of Pictures!,0
731,2016-07-22,Ivanka trump makes a pitch to women,0
738,2016-07-23,No to shark fin: China’s biggest shipping line Cosco pledges total ban on carrying product,2441
744,2016-07-23,Munich killer was bullied teenage loner who had obsession with mass murder,520
741,2016-07-23,"Tougher Europe borders push more migrants towards US: Europe's toughened borders are prompting migrants to switch focus to the United States, but their trek is being thwarted in Central America, where a bottleneck has formed, according to the International Organization for Migration.",56
755,2016-07-23,"6 Tortured Bodies Found In Veracruz, Mexico",39
746,2016-07-23,Bees spew water at their hive-mates when the temperature rises,35
749,2016-07-23,The hottest day EVER is recorded in Kuwait as temperature soars to 54C,35
756,2016-07-23,Husband Kills 5 months pregnant wife for 'honour' in Pakistan.,20
759,2016-07-23,Unusual bird-human partnership runs even deeper than scientists thought,12
743,2016-07-23,ISIS-linked newspaper banned in Singapore,9
745,2016-07-23,How Ukraine's financial elite plundered the nation,6
769,2016-07-23,India expels three Chinese state media journalists amid strained bilateral ties,3
753,2016-07-23,Munich shooting: Teenage killer Ali Sonboly 'inspired by far-right terrorist Anders Breivik' and 'used Facebook offer of free McDonald's food to lure victims',2
761,2016-07-23,"Turkey's Erdogan shuts schools, charities in first state of emergency decree",2
765,2016-07-23,IS attack in Kabul kills 80 and wounds 231,2
735,2016-07-23,Vladivostok Lures Chinese Tourists (Many Think It’s Theirs),1
736,2016-07-23,"Why ""find your life purpose"" is pretty bad advice",1
737,2016-07-23,How Police Succeeded at the Republican Convention,1
739,2016-07-23,Really like Basketball But Require Guidelines To Engage in Much better? Check Out These Concepts!,1
740,2016-07-23,Bloomberg: Germany Tries to Make Sense of Carnage as Terrorism Excluded,1
742,2016-07-23,"WW3 RUSSIANS STOCK PILE FOOD-,WAR IS CLOSE GERMAN SHOOTER WAS IRANIAN ?M...",1
747,2016-07-23,Deash uses Syrians as human shields in Manbij: US official,1
748,2016-07-23,IMANY - Don't Be So Shy (Filatov &amp; Karas Remix) | Official video,1
750,2016-07-23,Bernie Blasts Trump,1
751,2016-07-23,Straightforward Actions To Support You Better Comprehend Baseball,1
754,2016-07-23,Sibel Edmonds on Turkish Coup,1
757,2016-07-23,Bride-to-be who was buried alive by bodybuilder fiance reveals how she clawed herself out of a shallow grave,1
758,2016-07-23,Anyone Can Be A Fashionista With These Suggestions,1
760,2016-07-23,A MUST WATCH,1
762,2016-07-23,"Импульсы - Елена Темникова (Премьера клипа, 2016)",1
763,2016-07-23,Australian historic town of Bulga that is threatened with extinction,1
764,2016-07-23,White House condemns ‘apparent terrorist attack’ at a shopping mall in Munich in Germany,1
767,2016-07-23,"Bath Bombs Gift Set- Natural Stress Relief- 6 Lush, Moisturizing Handmade Fizzy Bath Bombs. Saturated in Shea Butter &amp; Coconut Oil. Unique Gift Idea for Her Or Him. A Luxury Bath Spa Gift For Everyone Review",1
768,2016-07-23,Why People Are Upset About the Batman: The Killing Joke Movie,1
752,2016-07-23,Israeli Knesset Passes Law Targeting Arab and Leftist Lawmakers,0
766,2016-07-23,"Saudis Offer Russia Untold Wealth, Greater Influence in Mideast",0
797,2016-07-24,Syrian refugee kills woman in new German outrage,34
775,2016-07-24,Al Qaeda Planning Kidnappings Of Westerners For Prisoner Swaps: Report,26
779,2016-07-24,Syrian refugee arrested after killing woman with machete in Germany: police,23
804,2016-07-24,Pregnant lady murdered and two harmed in machete assault in Germany,17
795,2016-07-24,👍Tour de France: Chris Froome makes history after claiming his third tour title,10
774,2016-07-24,Kabul in mourning after deadliest attack in 15 years,9
803,2016-07-24,"Years Before Truck Rampage in Nice, Attacker Wasn’t ‘Living in Real World’",6
781,2016-07-24,India urges 'maximum restraint' in restive Kashmir,4
782,2016-07-24,"Munich attack: Gunman Ali Sonboly planned shooting for a year, prosecutors say",4
787,2016-07-24,"Munich attack compels Germany to review gun laws. “Everything possible should be done to limit access to deadly weapons""",4
772,2016-07-24,Munich shooter planned attack for a year: police,2
783,2016-07-24,"Threats to Turkey not over, says Erdogan spokesman",2
802,2016-07-24,Syrian refugee kills woman with machete in Reutlingen in southern Germany,2
770,2016-07-24,2016 Recent releases EU may stress Volkswagen to compensate dirty diesel entrepreneurs news,1
771,2016-07-24,Top 10 upcoming Smartphones 2016,1
773,2016-07-24,﻿FREE Quotes On All Services,1
776,2016-07-24,Russia will not receive a blanket ban from Rio 2016 following the country's doping scandal,1
777,2016-07-24,"CNN - ""Tour de France 2016: Chris Froome cruises to third title.""",1
778,2016-07-24,2 ΓΥΦΤΟΠΟΥΛΑ ΛΕΝΕ ΤΗΝ ΑΛΗΘΕΙΑ ΓΙΑ ΤΟΝ ΤΣΙΠΡΑ,1
780,2016-07-24,What will be a a successful Democratic convention for Hillary Clinton?,1
784,2016-07-24,"Trump: Muslim Ban Expanded to Compromised Countries, Maybe France, Germany",1
788,2016-07-24,Donald Trump says French and Germans to face 'extreme vetting' entering the US,1
789,2016-07-24,Policewoman claims minister pressured her over Nice attack report,1
790,2016-07-24,Tigers maul 2 women at Beijing park,1
791,2016-07-24,Easy Running a blog Guidelines To Help You Do well,1
792,2016-07-24,Amnesty International: Detainees tortured in Turkey after failed coup,1
793,2016-07-24,VIDEO: Cristiano Ronaldo was out partying with Jennifer Lopez,1
794,2016-07-24,Syrian Refugee kills woman with machete in germany,1
796,2016-07-24,Russia says US must disclose location of Syria moderates to avoid hits,1
798,2016-07-24,"Turkey's Republician People's Party: ""We need to restructure state, stick to rule of law""",1
800,2016-07-24,"Burts Bees Fabulous Mini’s Travel Set, 6 Travel Size Products Review",1
801,2016-07-24,Home Improvement: A Key To Living A Better Life,1
785,2016-07-24,Deadly Machete Attack In Germany Kills One And Injures Two Others,0
786,2016-07-24,Amy Schumer and Margot Robbie (Hilariously) Blast Back After Bathing Suit Pics Surface,0
799,2016-07-24,"Top 10 Facts about ""Racial Injustice"" and ""White Privilege""",0
823,2016-07-25,Merkel's refugee policy was 'reckless': Left Party leader,1243
824,2016-07-25,The U.S. Blew $1.4 Billion on Abstinence Education in Africa,776
828,2016-07-25,Jordan gets its first Arabic LGBT-focused online magazine,115
831,2016-07-25,An alleged serial killer accused of drugging and murdering four men he met on gay dating websites faces 17 further charges related to attacks on eight other men.,37
839,2016-07-25,Horror as knifeman tries to stab women on train in latest shock violence to hit Germany,26
810,2016-07-25,Abbas says UK to be sued over Balfour Declaration,20
812,2016-07-25,"Doping whistleblower Yuliya Stepanova has questioned the ""unfair"" decision by the International Olympic Committee to ban her from the Rio Olympics.",18
825,2016-07-25,Yahoo sold to US telecoms giant Verizon,13
814,2016-07-25,Colombia declares end to Zika epidemic inside country,12
