,date,title,score
2731,2016-10-24,@ka_kameliatod : https://t.co/LQrIExAUoy - Perdez Du Poids En 31 Jours,1
2732,2016-10-24,Battle for White House: Missing issues from US 2016 presidential debates,1
2736,2016-10-24,"'Sexsomnia' trial hears ""no objective scientific evidence"" that a man can have sex while asleep",1
2738,2016-10-24,“HOW TO LOSE BELLY FAT” - “4 EASY STEPS TO LOSE WEIGHT FAST” - “HOW TO LOSE BELLY FAT FOR TEENAGERS”,1
2740,2016-10-24,Amy Schumer Made A 'Formation' Parody And Twitter Wasn't Having It,1
2741,2016-10-24,"Dilbert Cartoonist Willing To Support Anti-Fascist Coup, If Necessary",1
2742,2016-10-24,Bakery That Refused To Make Pro-Gay Cake Loses Discrimination Appeal,1
2744,2016-10-24,"Video: Reminisce feat. Seriki, Ice Prince &amp; Oladips – Feego",1
2746,2016-10-24,Health: 30% of Cancer Deaths Are Due to Smoking,1
2748,2016-10-24,"ROAD RAGE &amp; CAR CRASHES, Bad drivers compilation #486",1
2749,2016-10-24,@ka_kameliatod : https://t.co/QH0FxhR4EE - Programa De Entrenamiento Marketing Con Resultados,1
2750,2016-10-24,Teen Stuns Family After Waking From Coma Speaking Only Spanish,1
2751,2016-10-24,Donald Trump Says He Wants To Cut '70 To 80 Percent' Of Regulations,1
2754,2016-10-24,"Explosion Batters Neighborhood in China, Killing 10 and Wounding Dozens",1
2755,2016-10-24,@WeAreN2T : I added a video to a @YouTube playlist https://t.co/OTyuTkmjWw Top Best 레이샤 Laysha Fancam 161007 두원공대 축제 by 18,1
2756,2016-10-24,Sexual Booster Products | Call +1(318)-245-8078,1
2757,2016-10-24,ماهو الـ “chatbot”؟ وكيف يمكنه تسهيل حياتنا؟,1
2758,2016-10-24,Mom Pulls Daughter Out Of School After Teacher Says Her Hair 'Stinks',1
2759,2016-10-24,"St. Jude Heart Devices Can Be Hacked, Experts Say",1
2760,2016-10-24,This will save millions of lives,1
2761,2016-10-24,US stocks rally on upbeat earnings,1
2762,2016-10-24,Japan: stop the whale slaughter,1
2763,2016-10-24,The Walking Dead - season 7 - Episode 2 HD Trailer,1
2764,2016-10-24,Naked in Prague | Naked Girls walked down in the street of Prague | Naked Models in Prague - YouTube,1
2730,2016-10-24,Venezuela's embattled president meets pope at Vatican,0
2739,2016-10-24,8 Dramatic Pictures Of The Calais “Jungle” Clear-Out,0
2743,2016-10-24,"UK, Japan Air Forces to Hold First Joint Drills on Monday",0
2795,2016-10-27,"Russia denies involvement in deadly Syria school attack, but US official claim otherwise",77
2777,2016-10-27,"Chinese Communist Party expands Xi Jinping’s political power, anointing him ‘core’ leader",71
2767,2016-10-27,Chinese rally to farmer who killed official with nail gun,18
2782,2016-10-27,Monument erected at Palestinian university encourages martyrdom,16
2781,2016-10-27,World Health Organization ordering experts to withhold glyphosate findings,6
2783,2016-10-27,"Five members of Turkey's security forces and five Kurdish militants were killed on Thursday in clashes in the southeast, where unrest has flared since the arrest this week of two popular mayors",4
2773,2016-10-27,"Turkey to US: Drop PYD, let’s free Raqqa together - MIDEAST",2
2796,2016-10-27,Vine discontinuing the app.,2
2765,2016-10-27,Venezuela Throws In The Towel On Hyperinflation: Will Print 200x Higher-Denominated Bills,1
2766,2016-10-27,@blessedd77 : https://t.co/JMDJrhagWX - The Tip Advisor,1
2768,2016-10-27,Trump on KSNV,1
2769,2016-10-27,Pressure increases on “World’s Saddest Zoo” after Animals Asia report,1
2770,2016-10-27,'World's Happiest Man' Has A Plea For Treating Animals With Compassion,1
2771,2016-10-27,Michelle Obama Campaigns For Hillary Clinton In North Carolina,1
2772,2016-10-27,Besty Brandt On The 'Breaking Bad' Scene She Still Can't Watch,1
2774,2016-10-27,"Pregnant mother, five children electrocuted in Meghalaya",1
2775,2016-10-27,"Robert Miller and Future Electronics, Supports Eco-Friendly Clean Team Program",1
2776,2016-10-27,GPS Tracking Watch,1
2778,2016-10-27,Both Gigi And Bella Hadid Are Walking In This Year's Victoria's Secret Fashion Show,1
2779,2016-10-27,Pakistani police raided an opposition party youth rally in the capital on Thursday night and arrested about 40 people ahead of a planned protest that party leader Imran Khan has said would shut down the city,1
2780,2016-10-27,"The Walloons Pack A Wallop As Canada, Europe Agree To Tweak A Trade Deal",1
2784,2016-10-27,[Music] Tiwa Savage – Rewind,1
2785,2016-10-27,This Is The Most Deadly Interstate In The U.S.,1
2786,2016-10-27,The Kids In The Calais 'Jungle' Camp Are Running Out Of Options,1
2787,2016-10-27,4-Year-Old Forms Sweet Friendship With Elderly Man At The Grocery Store,1
2788,2016-10-27,Female Lawyer Accuses Justice Clarence Thomas Of Groping Her In 1999,1
2789,2016-10-27,How to make youtube channel for Multichannel network mcn,1
2790,2016-10-27,Cidade italiana inaugurou uma fonte permanente (e grátis) de vinho tinto,1
2791,2016-10-27,@blessedd77 : https://t.co/xfmwKNBl0W - Get Paid To Watch Movies? Show People How To Get Paid To Be Lazy!,1
2793,2016-10-27,تصل العقوبة إلى خمس سنوات.. تضامن واسع مع سعد لمجرد المتهم بالاعتداء الجنسي,1
2797,2016-10-27,Donnie Wahlberg Sets New Guinness World Record For Most Selfies With His Fans - Status Of Health,1
2798,2016-10-27,alugar som e iluminação em campinas,1
2799,2016-10-27,Grant Hill Says He Would Have Loved Playing In Today's NBA,1
2792,2016-10-27,"Diamond merchant gifts 400 flats, 1,260 cars to his employees as Diwali gifts",0
2794,2016-10-27,West Ham v Chelsea: Eight-year-old caught up in football violence,0
2832,2016-10-28,FBI To Reopen Investigation Into Hillary Clinton's Email,134
2801,2016-10-28,Russia Gets Voted Off U.N. Human Rights Council,74
2822,2016-10-28,Hyperloop just set up branch in Slovakia. Bratislava - Vienna is the first planned Hyperloop route in Europe,39
2810,2016-10-28,U.N.: ISIS Is Using Tens Of Thousands Of Civilians As Human Shields In Mosul,31
2816,2016-10-28,Hillary Email Investigation reopened by FBI,17
2808,2016-10-28,Russia Gets Voted Off U.N. Human Rights Council,11
2813,2016-10-28,Mosul battle: 'Tens of thousands of civilians' used as human shields,9
2831,2016-10-28,U.N. Negotiates Release of 876 Children Detained by Nigeria’s Military,6
2807,2016-10-28,Nigeria to spend $10bn to end conflict in oil-rich Niger Delta,5
2804,2016-10-28,Death of former Russian press minister in Washington ruled accidental,3
2809,2016-10-28,FBI to investigate additional emails from Clinton’s private server,3
2823,2016-10-28,Uber drivers are entitled to holiday wages and paid leaves.,3
2811,2016-10-28,WhatsApp warned over Facebook data share deal,2
2800,2016-10-28,Dutch PM urges opposition to support EU-Ukraine treaty,1
2802,2016-10-28,This Teenager's Gory Special Effects Videos Are Bloody Impressive,1
2803,2016-10-28,Lady Gaga Megafan Honors The Pop Diva With This Incredible Mashup,1
2805,2016-10-28,@ka_kameliatod : https://t.co/ci41bIETEB - Carp Fishing Secrets.,1
2806,2016-10-28,How could the UK help Nissan remain competitive?,1
2812,2016-10-28,'The day I killed my rapist',1
2814,2016-10-28,FBI Reopens Clinton E-Mail Probe Less Than Two Weeks Before Vote,1
2815,2016-10-28,President Obama explains why Michelle will never run for office,1
2817,2016-10-28,Mother Of Pulse Nightclub Victim Campaigns Out For Hillary Clinton,1
2818,2016-10-28,Markets Dip After FBI Says It's Looking Into More Clinton Emails,1
2819,2016-10-28,PM to celebrate Diwali with ITBP,1
2820,2016-10-28,US election: Why does the US have such low voter turnout?,1
2821,2016-10-28,Ini Visi dan Misi Abdulah Puteh – Sayed Mustafa Usab,1
2824,2016-10-28,Video Shows Donald Trump Sexually Humiliating Woman Before Large Audience,1
2825,2016-10-28,This Guy's Rendition Of Adele's 'Hello' Is Why The Internet Was Created,1
2826,2016-10-28,Chris Hemsworth Perfectly Called Himself Out On Cultural Appropriation,1
2827,2016-10-28,Paul Ryan Renews Call To Suspend Hillary Clinton's Classified Briefings,1
2828,2016-10-28,Why Are Black People Expected To Support Every Black Filmmaker?,1
2829,2016-10-28,DISCOVER !! FINAL EVOLUTION of the Starter Pokémon | Pokémon Sun and Pokémon Moon!,1
2830,2016-10-28,"Police Officers Thought They Found Stolen Cars, But What These Actually Are Is Horrifying",1
2833,2016-10-28,"Philippines mayor, bodyguards killed in shootout",1
2834,2016-10-28,Japan holds Nigerian asylum seeker in solitary confinement,1
2862,2016-10-29,"Swiss rail travel more expensive than driving, rail transport has been steadily becoming more expensive than driving in Switzerland, according to an investigation conducted by the federal cost oversight office.",211
2860,2016-10-29,Consumer Watchdog Rejects Half of Russian Butter,61
2869,2016-10-29,Sweden is set to tighten its rules on parental leave benefits for immigrating parents by capping the period for which they can claim the pay-outs.,48
2851,2016-10-29,"Gunmen kill four at Shi'ite Muslim gathering in Karachi, Pakistan",15
2859,2016-10-29,"Yemeni President Hadi rejects a UN-proposed peace deal aimed at ending the country's devastating war, saying it ""rewards"" rebels.",11
2837,2016-10-29,"Exhibit replica of Hitler's bunker opens in Berlin, a museum in the German capital has unveiled a copy of the bunker where Adolf Hitler spent his final days.",9
2866,2016-10-29,"Pizza the polar bear showing signs of mental decline in Chinese mall, activists say.",9
2865,2016-10-29,Morocco: Outrage in Al-Hoceima Following Tragic Death of a Fish Seller,8
2840,2016-10-29,"Recently announced discovered papyrus with oldest Hebrew mention of Jerusalem may be forgery, experts warn.",2
2841,2016-10-29,"Knifeman on the run, stabbing attack in Frankfurt train station.",2
2835,2016-10-29,US may 'navigate and direct' ISIS terrorists from Mosul into Syria - Assad aide,1
2836,2016-10-29,Joe Biden Caught Groping Children On Video,1
2838,2016-10-29,Vimbai celebrates BET hosting gig with new photos,1
2839,2016-10-29,Clinton Campaign Turns Its Fire On FBI Director James Comey,1
2843,2016-10-29,Paykasa Kart Al,1
2844,2016-10-29,@ralicap1 : https://t.co/fwHskfLdbf - Insomnia Free 4 Life ~ 7.45% Conversions,1
2845,2016-10-29,Finally this Invincible watch Made,1
2846,2016-10-29,Katy Perry Channels Hillary Clinton For Halloween – See The Amazing Transformation!,1
2848,2016-10-29,13 Celebrities (And Counting) Who Totally Killed It This Halloween,1
2849,2016-10-29,Kumawood actress Kyeiwaa rubbishes death rumors,1
2850,2016-10-29,@blessedd77 : https://t.co/T1xzj21Itl - Bessere Brote,1
2852,2016-10-29,Russia Voted Off U.N. Human Rights Council,1
2853,2016-10-29,مشاهدة مباراة الأهلي والإتحاد بث مباشر,1
2854,2016-10-29,Hillary Clinton’s Campaign Hits Back at FBI Chief James Comey,1
2855,2016-10-29,Germany announces ‘zero tolerance’ policy against creepy clowns ahead of Halloween,1
2856,2016-10-29,Trump Admits to Relationship with Putin in 2013,1
2857,2016-10-29,"Confused about why a ""Pirate Party"" will become the largest political party on Iceland today? (a list of coverage over the years)",1
2858,2016-10-29,Incredible summary of S Korean President Park's current scandal,1
2861,2016-10-29,Sania-Martina crash out of WTA Finals semis,1
2863,2016-10-29,"Surprise, Surprise, Donald Trump's Supporters Are Trying To 'Rig' The Election",1
2864,2016-10-29,FBI Director James Comey Defied Attorney General With Email Announcement,1
2867,2016-10-29,@ralicap1 : https://t.co/qVYzdSp2OL - Product For Men Who Want To Date Better Women,1
2868,2016-10-29,Knifeman on the run after stabbing four people in Frankfurt train station in Germany,1
2842,2016-10-29,"Muslim Rapes And Violently Sodomizes Woman For Twenty Minutes, Swedish Court Acquits All Charges Against Him And Gives Him Fifteen THOUSAND Dollars For His Time In Prison",0
2847,2016-10-29,"For Democrats, New Focus on Clinton Email Is ‘Like an 18-Wheeler Smacking Into Us’",0
2874,2016-10-30,"Bolivia, which holds 20 percent of the world's tropical glaciers has seen its glaciers shrunk by 43% since the mid-1980s. The melting has left behind at least 25 unstable glacial lakes capable of causing sudden and catastrophic outburst floods.",1513
2892,2016-10-30,Most distant galaxy cluster ever recorded captured 11bn light years away,611
2897,2016-10-30,"Iraqi government bans miniskirts, tight trousers for female students",160
2879,2016-10-30,Gruesome Video Shows Turkish Soldiers Execute Female Kurdish PKK Fighters by Shooting in Their Heads,66
2890,2016-10-30,"300 ISIS child soldiers from Syria killed in Mosul operation, Syrian watchdog says",42
2878,2016-10-30,Aleppo siege: UN envoy Mistura 'appalled' by rebel attacks - BBC News,13
2896,2016-10-30,Aleppo: Putin rejects army request to resume air raids,13
2898,2016-10-30,Yemen: Dozens killed in Saudi-led coalition air raids,11
2885,2016-10-30,"""Pope Francis hopes that his upcoming visit to Sweden on the 500th anniversary of the Protestant Reformation will help in uniting Christians.""",6
2880,2016-10-30,Women Win 30 Seats In Iceland's Parliament — More Than Any Party,3
2889,2016-10-30,China tries to 'divide and rule' Taiwan by befriending pro-Beijing towns,2
2870,2016-10-30,Manhunt for suspects after 4 stabbed at German train station,1
2871,2016-10-30,"LIVE Stream: Donald Trump Rally in Las Vegas, NV",1
2872,2016-10-30,@ka_kameliatod : https://t.co/5k84KCTheG - https://t.co/bwsK9BzdCx,1
2873,2016-10-30,IRL Iron Man Suit?,1
2875,2016-10-30,Solar industry rollercoaster offers a bumpy ride,1
2877,2016-10-30,http://ift.tt/2bvZTev,1
2881,2016-10-30,@ralicap1 : https://t.co/2FVQBPVWwy - Create Your Skincare For The Holidays,1
2882,2016-10-30,Religious life turned upside down by Italian earthquake,1
2883,2016-10-30,Kanal Video Membosankan Agar Orang Lekas Tidur,1
2884,2016-10-30,Anonymous - World War 3 is on the Horizon 2016,1
2886,2016-10-30,"চ্যালেঞ্জ জয়ী মিরাজ, ইংল্যান্ড টেস্ট সিরিজে রেকর্ড গড়ে মান অফ দ্যা ম্যাচ মেহেদী হাসান মিরাজ।bd cric",1
2888,2016-10-30,الريال يجدد عقد بيل حتى 2022,1
2891,2016-10-30,Thousands throng Puri for ancestor worship ritual,1
2893,2016-10-30,Ben Heck's multi-system retro controller,1
2894,2016-10-30,"দুর্দান্ত বাংলাদেশ, অসাধারণ জয়! জয় ! টেস্টে ইংল্যান্ড এর বিপক্ষে ঐতিহাসিক জয় বাংলাদেশের , মিরাজের ৬",1
2895,2016-10-30,@ralicap1 : https://t.co/33CBv8mlyA - Natuerliche Penisvergroesserung - Bestseller: Fast 30 Euro/sale...,1
2899,2016-10-30,Introduction to Architecture &amp;amp; Environmental Design,1
2900,2016-10-30,“MAKEUP TUTORIAL FOR BEGINNERS” - “HOW TO APPLY MAKEUP”,1
2901,2016-10-30,"Black Woman Response To Trick Daddy “Tighten Up, You hoes Useless”",1
2903,2016-10-30,@Blogmarketing_L : https://t.co/w8kP3xhlEA - The Pageant Playbook,1
2904,2016-10-30,বেন স্টোকস এবং সাকিবের স্যালুটের গল্প । bangladesh cricket news 2016,1
2876,2016-10-30,Justin Bieber blames his fans for why he stormed off Manchester stage in open letter,0
2887,2016-10-30,"Bolivia, which holds 20 percent of the world's tropical glaciers has seen its glaciers shrunk by 43% since the mid-1980s. The melting has left behind at least 25 unstable glacial lakes capable of causing sudden and catastrophic outburst floods.",0
2902,2016-10-30,"Bolivia, which holds 20 percent of the world's tropical glaciers has seen its glaciers shrunk by 43% since the mid-1980s. The melting has left behind at least 25 unstable glacial lakes capable of causing sudden and catastrophic outburst floods.",0
2908,2016-10-31,North Korea is Paying Internet Commenters to Spread Lies About South Korea,369
2928,2016-10-31,Israel trying to block Palestinians from Interpol,41
2935,2016-10-31,"Zika may cause men's testicles to SHRINK by up to 90 per cent and permanently reduce fertility, medical researchers warn",23
2931,2016-10-31,Trump: Clinton email 'motherlode' found - BBC News,7
2912,2016-10-31,Woman in scandal roiling S. Korea says she 'deserves death',5
2934,2016-10-31,UAE jails seven for links to Hezbollah,2
2939,2016-10-31,"15,000 left homeless by Italy's most powerful quake since 1980",2
2906,2016-10-31,"ROAD RAGE &amp; CAR CRASHES, Bad drivers compilation #491",1
2907,2016-10-31,@ka_kameliatod : https://t.co/v06VsJMhYS - Quit Alcohol With Seb Grant,1
2909,2016-10-31,"Stop Comparing 'Emailgate' To Watergate, Says Man Imprisoned For The Latter",1
2910,2016-10-31,Jupiter to perform in South Africa tomorrow,1
2913,2016-10-31,[Music] Iyanya – Up To Something ft. Don Jazzy &amp; Dr Sid,1
2914,2016-10-31,"Over 540,000 People Petition Pakistan to Release Christian Mother Asia Bibi From Death Row",1
2915,2016-10-31,"Trump's rise 'isn't crazy and it's not going away,' billionaire Peter Thiel says",1
2916,2016-10-31,Bank of England's Mark Carney says he will leave in June 2019 - BBC News,1
2917,2016-10-31,A Brief And Spooky History Of The Word 'Boo',1
2918,2016-10-31,Trump Bizarrely Displays Rainbow Flag Declaring 'LGBT For Trump' At Rally,1
2919,2016-10-31,"Civilians Fleeing Through ISIS Minefields Face Detention, Prison-Like Conditions In Northern Iraq",1
2920,2016-10-31,Donna Brazile Appears To Have Sent CNN Debate Question To Clinton Campaign,1
2921,2016-10-31,Judge: Orlando Nightclub Shooter's Calls With Police Must Be Released,1
2922,2016-10-31,Mexico City Stages James Bond-Inspired Day Of The Dead Parade,1
2923,2016-10-31,Adele Will Have 'No Man' Telling Her To Shave Her 'F***in' Legs',1
2924,2016-10-31,Health: Zika Virus Reduces Male Fertility In Mice,1
2925,2016-10-31,Putin supported the idea of the development of the Russian nation law,1
2927,2016-10-31,"U.S. diplomat to head to Venezuela as government, opposition agree on talks",1
2929,2016-10-31,@ka_kameliatod : https://t.co/OiC4npEhOv - The Salary Negotiation Secret Formula,1
2930,2016-10-31,Is America TOO Accommodating To Foreigners? The Costs Of Multi-lingual Media.,1
2932,2016-10-31,"8 Top and best video converter|update version|Editor, player, Downloader...",1
2933,2016-10-31,Diwali celebrations severely hit air pollution (Roundup),1
2936,2016-10-31,"WikiLeaks on Twitter: ""Former CNN host, current DNC Chair Donna Brazile, exposed as leaking 2nd townhall question to Hillary Clinton""",1
2937,2016-10-31,Athens court acquits defendant of Marfin firebombing attack,1
2938,2016-10-31,GOD wants you to prosper.,1
2905,2016-10-31,Bhopal jailbreak: Police reject criticism of fake encounter of SIMI activists : Indian Police,0
2911,2016-10-31,"No, the U.S. Navy Isn't Battling Breast-Cancer With Pink Fighter Jets. But Israel Is",0
2926,2016-10-31,Montreal police monitored iPhone of a journalist,0
316,2016-11-07,Facebook Sued for $1 Billion for Alleged Use of Medium for Terror,833
321,2016-11-07,Astronomers discover distant dwarf planet beyond Neptune,533
337,2016-11-07,Bornean Orangutans are now Critically Endangered,25
320,2016-11-07,Next PM Theresa May often demands the scientifically impossible,24
331,2016-11-07,"Germany's foreign intelligence service was spying on a ""double-digit"" number of EU and NATO governments until 2013, according to a parliamentary committee report. The BND also spied on a German citizen.",20
343,2016-11-07,Microsoft scraps Finland phone unit and it's 1350 jobs - BBC News,8
319,2016-11-07,Heavy gunfire erupts in South Sudan after president calls ceasefire,4
334,2016-11-07,Rebels attack government lines in Syria's Aleppo after supply road cut,3
329,2016-11-07,Relatives of Palestinian attack victims sue Facebook for $1 billion in U.S.,2
342,2016-11-07,Baton Rouge photo everyone is talking about,2
315,2016-11-07,Владимир Путин присутствовал на торжественной литургии в... Новости Перв...,1
317,2016-11-07,A Simple and Free Tool to Overcome PDF to Excel Troubles,1
318,2016-11-07,THWGlobal. Новости. Ответы на самые часто задаваемые вопросы,1
322,2016-11-07,Helpful Tips for Editing Business Content - Local Business Marketing Solutions,1
323,2016-11-07,VIDEO : Zim Police Brutalizes Civilians As the World Watches!!,1
324,2016-11-07,Theresa May Prepared to Be Britain’s Next Premier as Andrea Leadsom Quits Race,1
325,2016-11-07,"Taliban’s New Leader, More Scholar Than Fighter, Is Slow to Impose Himself",1
326,2016-11-07,Thomson Reuters in $3.55bn sale of IP and science business,1
327,2016-11-07,Britain's May wins PM race after pro-Brexit rival quits,1
328,2016-11-07,Brexit : Theresa May to replace David Cameron as sole candidate of British Prime Minister as Andrea Leadsom quits Tory leadership race,1
330,2016-11-07,Eco-Shopper,1
332,2016-11-07,﻿Why Shift To Accounting Software?,1
333,2016-11-07,Amazing Opening - Chris Christie Introduces Donald Trump In Virginia Bea...,1
335,2016-11-07,Preturi mai ieftine la service masini de spalat Ariston in acest sezon,1
336,2016-11-07,South Sudan's President Salva Kiir declares immediate ceasefire : State TV,1
340,2016-11-07,Dallas Police Chief David Brown on Bombing Attack Suspect: 'I'd Do It Again',1
341,2016-11-07,Speculation over whether Nigel Scullion will remain in Cabinet as Nationals gather in Canberra,1
345,2016-11-07,Dallas' top cop has answer for protesters: Join us | Fox News,1
347,2016-11-07,Viral video tells a story of true love between special needs couple,1
348,2016-11-07,Brexit : Worst rise in UK hate crimes caused by EU referendum: Police,1
349,2016-11-07,Philippine army kill 40 Daesh-linked Abu Sayyaf militants,1
338,2016-11-07,Minn. officer suffers spinal fracture during I-94 protest,0
339,2016-11-07,US Teens Accused Of Using Pokemon Go To Rob,0
344,2016-11-07,Not too late to reap gains after S&amp;amp;P 500 hits high: Strategist,0
346,2016-11-07,Tips to Get Flat Stomach - 3 Tips carried Out Correctly That rid Of Belly Fat Fast,0
1424,2016-11-08,Erdogan cancels Turkish singer Sıla’s concerts after democracy rally remarks,58
1401,2016-11-08,"Thailand resort hit by two bombs, BBC reports",46
1429,2016-11-08,Scotland just produced enough wind energy to power it for an entire day,24
1430,2016-11-08,BOMBS ROCK THAI RESORT ‘One woman dead’ and 10 injured including foreign tourists injured as two explosions rip through popular resort of Hua Hin,22
1423,2016-11-08,"Terrorist attack in Hua Hin, Thailand, eleven injured. Amongst them, several tourists.",21
1408,2016-11-08,Deadly Bombing At Thailand Tourist Resort,12
1420,2016-11-08,Shot Canadian 'planned immediate attack' - BBC News,12
1411,2016-11-08,BBC News: Shot Canadian 'planned immediate attack',11
1419,2016-11-08,Syria conflict: Footage shows 'chlorine attack' aftermath - BBC News,6
1402,2016-11-08,"Former Toronto Mayor, Rob Ford, Crack Video Released",4
1415,2016-11-08,France calls on public to house refugees as asylum centers reach bursting point,4
1414,2016-11-08,Turkey may seek non-NATO options for defense industry cooperation: foreign minister,3
1412,2016-11-08,"Remove shirtless Justin Trudeau images from ads, B.C. photographer tells Conservative Party",2
1425,2016-11-08,UK's Labour Party at war over who can vote in leader race,2
1432,2016-11-08,Americans miss out on Olympic rugby sevens quarterfinals,2
1400,2016-11-08,Reasons for SR22 Auto Insurance,1
1403,2016-11-08,Descubren en el sistema solar un objeto que desafía nuestros conocimientos astronómicos,1
1404,2016-11-08,77 killed in Nepal as monsoon rains trigger massive flood,1
1406,2016-11-08,World No.1 paddler Ma Long reaches final in Rio 2016 Olympics,1
1409,2016-11-08,US warns Israel over destroying Palestinian village of Sussiya in the occupied West Bank,1
1410,2016-11-08,WW3 TYPHOONS SCRAMBLED TO INTERCEPT RUSSIAN BOMBERS FOR LAST 3 DAYS,1
1413,2016-11-08,What3words keeps Olympics visitors on track in Rio on cin news,1
1416,2016-11-08,"#CHAUBOTIN HD MARIANA ZUVIC , CAMBIEMOS .",1
1417,2016-11-08,Industrial explosion in central China kills at least 21,1
1418,2016-11-08,﻿Capsol,1
1421,2016-11-08,Nobita ke awaz ke peche aik esa insan jis ka ap soch be nai sakte,1
1422,2016-11-08,Donald Trump under oath struggled with the truth,1
1426,2016-11-08,"Obama released the details of the property, home in Chicago take for loans - Blogvirals",1
1427,2016-11-08,Robert Downey Jr. Confirms He Loves Tom Hiddleston Just as Much as Taylor Swift,1
1428,2016-11-08,Bengaluru man breaks long jump world record while trying to jump over a pothole,1
1431,2016-11-08,ยินดีแนะนำเว็บเปิดจำหน่ายรีโมททุกชนิด รีโมทแอร์ lg ขายรีโมทแอร์ lg ราคาส่ง รีโมทแอร์แอลจีและยี่ห้ออื่น ๆ มากมายที่นี่,1
1434,2016-11-08,LOLセ천안오피クシ밤포유ーなBAM4U16.COMダン2016 국내 최대 유흥정보ガールグ청주오피ループ일산오피ランキ대전오피ング,1
1405,2016-11-08,"Same old rules, storefront dispensaries bad.",0
1407,2016-11-08,Daredevil toys with drop-in of death at Hong Kong skyscraper (VIDEO),0
1433,2016-11-08,"A man was rammed by a three wheeler, he bleed to death as no one stopped to help him, a sad moment for all of humanity",0
2440,2016-11-10,Nobody wants to host the Olympic Games,108
2442,2016-11-10,Egyptian MP faces backlash for trying to make the punishment for adultery gender neutral,107
