,date,title,score
1341,2016-09-08,"Israel has charged a UN aid worker from Gaza with using his position to help the militant Hamas movement, in the second such case in a week.",17
1363,2016-09-08,"In Uganda, solar power plant amid African bush inspires hope",7
1335,2016-09-08,Germany's Nazi hunter tracks down eight concentration camp workers,6
1340,2016-09-08,"Judge who approved torture under Bush administration changes stance, allows foreign citizens to contest convictions based on evidence gathered under torture. ""A coerced statement is not competent evidence""",3
1351,2016-09-08,A forest fire that has been burning on the Canary Island of La Palma for six days is suspected to have been started by a man who set fire to his toilet paper,3
1345,2016-09-08,"Taliban declares war against Daesh -“All those who are fighting in Afghanistan and killing innocent people are our enemies. We will fight every terrorist group. Afghanistan will not consider those countries as friends who are supporting militants,” says Ministry of Defense’s spokesman",2
1332,2016-09-08,UFC fighter Dennis Bermudez challenges Youtuber to break his world record. Here is the Youtubers response/attempt,1
1334,2016-09-08,"Welcher Mann wünscht sich nicht, ein guter Liebhaber über sein? Jeder Mann möchte seine Partnerin sexuell zufrieden mach",1
1337,2016-09-08,Work from home?,1
1338,2016-09-08,"Donald Trump is a security threat, says Kim Beazley",1
1342,2016-09-08,Orkut creator launches new social network called Hello to challenge facebook - Blogvirals,1
1343,2016-09-08,"Taliban declares war against Daesh -""Our fighters [ Taliban are committed and ready to eliminate Daesh from Afghanistan. We will fight them [Daesh] in cooperation of Afghan nation,” he said.",1
1344,2016-09-08,"Daesh elimination boosts Iraq unity, solidarity: Iran",1
1350,2016-09-08,Russians protest against new anti-terrorism law: Activists have called the changes repressive and said they could be used to pressure Kremlin opponents ahead of a parliamentary election in September. New York-based Human Rights Watch has called the new laws draconian,1
1352,2016-09-08,Enhancing Your Lifestyle With Home Improvements,1
1353,2016-09-08,BREAKING - REAL HISTORY - Special Report - INFOWARS COM,1
1354,2016-09-08,No Nonsense Muscle Building Book - At A Glance,1
1355,2016-09-08,Get The Most From Your Muscle Building Exercise!,1
1357,2016-09-08,"Allahabad school bans national anthem, Centre says won't accept insult",1
1358,2016-09-08,Upgrade Your Apple Mac OS Today,1
1359,2016-09-08,Wine theme park in french,1
1360,2016-09-08,Miranda Kerr Dishes on One of the Best Gifts She's Ever Received From Her Fiancé Evan Spiegel,1
1361,2016-09-08,"""Did anyone actually look at this photo before it was published?""",1
1362,2016-09-08,Whatsapp Funny Video | Arabic Nude Sexy Girls Fight,1
1364,2016-09-08,How to Decide on a Vibrator for Newcomers or Knowledgeable Sex Toy End users,1
1333,2016-09-08,"Philippines leader calls US ambassador S.O.B. &amp; gay, Washington demands clarification: US Press Office director Elizabeth Trudeau said that the remarks made by the Philippines’ president concerning Goldberg were “inappropriate,” while refusing to quote them",0
1336,2016-09-08,PM Nawaz urges UN for efforts to end Indian atrocities in IoK,0
1347,2016-09-08,Arrested US citizen reveals about his earlier visits to Pakistan,0
1348,2016-09-08,Ukrainian miner sets himself on fire over wage delays,0
1356,2016-09-08,Tennessee man charged with killing 11yo daughter after first day at school,0
2380,2016-09-10,"UN has become a burden on humanity, President Erdoğan says",1201
2383,2016-09-10,All 3.6 million EU nationals 'can stay in the UK after Brexit',358
2395,2016-09-10,13 year old Jain girl in India dies after 68 days of religious fasting. According to the police and neighbours she was encouraged and supported in this extreme step by her family to earn social respect,204
2401,2016-09-10,Iraqi woman stoned to death for refusing to marry ISIS jihadist,152
2391,2016-09-10,"PA President Abbas’ Fatah Movement Hails Terrorist ‘Martyr’ Who Slaughtered 2 Israelis, Wounded 6 Others in Jerusalem Shooting Spree",109
2403,2016-09-10,Vladimir Putin awarded 'Hugo Chavez Prize for Peace and Sovereignty' by Venezuela,52
2405,2016-09-10,New species of Jurassic marine reptile discovered,7
2396,2016-09-10,President Erdoğan: UN a burden on humanity,3
2384,2016-09-10,Saudi Arabia promises investigation following outrage at Yemen funeral airstrike that killed 140,2
2389,2016-09-10,Facebook revenge pornography trial 'could open floodgates' | Technology,2
2414,2016-09-10,US funding 'Israeli state terrorism' in military deal,2
2381,2016-09-10,Paul McCartney And Neil Young Perform Beatles Classics At Desert Trip Music Festival,1
2382,2016-09-10,"Two Israelis Shot Dead In Jerusalem, Palestinian Attacker Killed",1
2386,2016-09-10,GOP Chances Riding On Trump’s Ability To Offer A Sincere Apology,1
2387,2016-09-10,Lin-Manuel Miranda Is Every Inspirational Movie Teacher In 'SNL' Parody,1
2388,2016-09-10,India is laying the groundwork for the formation of a space command to give it a military edge in the tense South Asia region; Space the final frontier for PM Narendra Modi’s military modernisation push,1
2392,2016-09-10,Ξεμπροστιάζουν τον Ερντογάν: Προτεραιότητα της Άγκυρας οι Κούρδοι-Για “τα μάτια” η μάχη κατά του ISIS,1
2393,2016-09-10,Rudy Giuliani: Bernie Sanders Would Be The Nominee If Clinton's Wall Street Speeches Came Out Earlier,1
2394,2016-09-10,Mane inspired by 'smiling' Ronaldinho,1
2398,2016-09-10,Toddler 'died for six minutes' after deadly snake bite in Australia https://www.youtube.com/watch?v=t-MVCdcTnow,1
2399,2016-09-10,England vs Bangladesh report: Jos Buttler's lone rally proves futile as hosts clinch series-equalising win,1
2400,2016-09-10,"5 simple method for creating your own blogging site, and get ready for earning",1
2402,2016-09-10,Top 20 biggest vegetable and fruit in the world,1
2406,2016-09-10,"Poción restaurant by studioBIG, New York",1
2407,2016-09-10,Selena Gomez Spotted in Tennessee Amid Break From Showbiz,1
2409,2016-09-10,Tim Kaine: Donald Trump's Comments Indicate 'A Pattern Of Sexual Assault',1
2410,2016-09-10,This comment nails each and every member of /r/The_Donald,1
2411,2016-09-10,"IMF (USA) / EU and Greek (CCUA) debt (fraud), Charlatans,Cheats,Usurers,Adventurers etc, all together do not they know what about… they have lost the ball !!!",1
2412,2016-09-10,India’s first obesity clinic for adolescents opens in Mumbai,1
2413,2016-09-10,bangladesh cricket news UPDATE 2016,1
2385,2016-09-10,"Even before she assumes power, she wants a war.",0
2390,2016-09-10,Germany sets aside €30 million to compensate men convicted of gay sex,0
2397,2016-09-10,We want freedom’: Kashmir could face biggest protest against Indian rule in recent years,0
2404,2016-09-10,"Russia Hack of U.S. Politics Bigger Than Disclosed, Includes GOP",0
2408,2016-09-10,Is this the age of the bum? After a giant bottom was revealed in the exhibition for this year’s Turner Prize...,0
1952,2016-09-14,Russia bans Pornhub,5698
1932,2016-09-14,First-Ever Discovery: Complex Organic Molecules Found on Rosetta's Comet,568
1941,2016-09-14,"Death metal singer ""accidentally"" elected to town council",308
1930,2016-09-14,"Child porn still thrives in Japan despite so-called crackdown, says rights group",302
1936,2016-09-14,10 Years in Prison For Online Pirates a Step Closer in the UK,93
1949,2016-09-14,Turkey and US forces hit more ISIL targets in Syria,36
1953,2016-09-14,Undercover Millionaire: How a Cop Tasked With Fighting Corruption Ended Up With $125 Million in Cash,33
1927,2016-09-14,Too sensitive? Sex toy maker sued over collection of intimate data - Ottawa-based 'We-Vibe' maker subject of U.S. class-action lawsuit,26
1950,2016-09-14,Superbug Explosion Triggers U.N. General Assembly Meeting,24
1944,2016-09-14,Senior Saudi policy adviser: U.S. 'sponsors of terrorism' bill could fuel extremism,21
1931,2016-09-14,Brazil ex-president Lula faces charges - BBC News,12
1940,2016-09-14,Calais migrants set off wall of fire amid growing concerns for truckers safety,11
1937,2016-09-14,7 killed in separate Baghdad attacks,3
1925,2016-09-14,Angela Porter’s Zen Doodle Designs: New York Times Bestselling Artists’ Adult Coloring Books Review,1
1928,2016-09-14,Aid Convoys Stuck in on Turkish-Syrian Border in Aleppo,1
1929,2016-09-14,"Eid-ul-Azha chronicles: Cow jumps from roof, gets stuck between two walls",1
1933,2016-09-14,تمديد وقف الاقتتال في سوريا 48 ساعة إضافية,1
1934,2016-09-14,Pinned to Libya on Pinterest,1
1939,2016-09-14,Is North Korea getting ready for nuclear war?,1
1945,2016-09-14,Áo Phản Quang 3m Kiểu Số 17 Chất Lượng Cao - Cực Đẹp,1
1946,2016-09-14,Teen appears in court accused of planning mass-casualty nail bomb attack on Buckingham Palace and Elton John.,1
1947,2016-09-14,Teen Accused Of Planning Bomb Attack On Elton John Concert Investigators say it could have been one of the worst terrorist attacks in UK history.,1
1948,2016-09-14,juventus vs seville live stream - champions league - juventus vs sevilla...,1
1951,2016-09-14,Pinned to Libya on Pinterest,1
1954,2016-09-14,"Every Time You Watch the Video of Hillary Fainting, Rupert Murdoch Makes Some Big Money",1
1955,2016-09-14,Brazil's former president Lula charged in money laundering investigation,1
1956,2016-09-14,Youtube Is Hiding This Video! The Economy Is Collapsing -- Martial law &amp;...,1
1957,2016-09-14,Áo phản quang 3m kiểu 16 chất lượng cao và giá tốt nhất ✓✓✓,1
1958,2016-09-14,Head of Libya's UN-backed Government of National Accord (GNA) seeks talks after seizure of oil ports,1
1959,2016-09-14,﻿Отзывы О Работе Для Девушек В Париже,1
1926,2016-09-14,Large-scale animal sacrifices turn streets of Bangladesh capital into rivers of blood,0
1935,2016-09-14,Obama Compares Putin’s Approval Rating With Saddam Hussein’s Poll Numbers,0
1938,2016-09-14,Media not covering Balochistan conflict adequately: Afghan President Ashraf Ghani,0
1942,2016-09-14,International probe into Kashmir killings imperative now: UN rights chief,0
1943,2016-09-14,"India raises Balochistan, PoK issue at UN, hits out at Pakistan",0
1989,2016-09-16,"1.5 billion birds missing from North American skies: New ‘alarming’ report finds 86 species of birds are threatened by plummeting populations, habitat destruction and climate change.",1081
1986,2016-09-16,US troops forced out of Syrian town by anti-Assad rebels- Video purportedly shows supposed American allies of the Free Syrian Army chanting: 'We're going to slaughter you',206
1965,2016-09-16,"South Sudan is now 4th country in the world w/ more than 1 million refugees. Others: Syria, Afghanistan &amp; Somalia",159
1985,2016-09-16,US troops 'forced to flee Syrian town' after FSA rebel threats - Video shows Free Syrian Army fighters threatening to 'slaughter' US special forces after they moved into al-Rai with Turkish troops,18
1961,2016-09-16,Muslim woman loses baby in 'racist' attack - BBC News,6
1973,2016-09-16,Ohio police officer kills black teenager 'who drew BB gun',6
1983,2016-09-16,Romania: Timișoara has been elected European Capital of Culture for the year 2021.,3
1979,2016-09-16,Kenya or Somalia: Who owns the sea?,2
1980,2016-09-16,Islam Brings Literal Rivers of Blood to the Streets of Bangladesh.,2
1981,2016-09-16,"Brexit vote was rejection of economic status quo, says Jeremy Corbyn",2
1960,2016-09-16,"Trump: President Barack Obama was born in the United States, period",1
1962,2016-09-16,Mark Cuban offers $10 million to interview Trump on policies,1
1963,2016-09-16,Bahrainis hold demonstration to slam ban on Friday prayers,1
1964,2016-09-16,Stella by Stella McCartney Eau de Parfum 50ml,1
1966,2016-09-16,“منى”.. أصغر مولودة في العالم تصعد جبل عرفات,1
1967,2016-09-16,What makes a website Interesting?,1
1968,2016-09-16,Anointedtoday.blogspot.com: What Is All the Hype About Linky Parties?,1
1969,2016-09-16,Belgium police arrest two in anti-terror raids,1
1970,2016-09-16,Iran oil exports at highest level in almost five years,1
1972,2016-09-16,"A first look at David Bowie's art collection, which is being actioned off",1
1974,2016-09-16,T400 Jewelers “Dream Chasers” Love Gift Swarovski Elements Crystal Butterfly Pendant Necklace Women’s Jewelry (Alloy with Purple color) Review,1
1975,2016-09-16,Neil Balme warns there's no quick fix for Tigers' woes,1
1976,2016-09-16,نيوزيلندية تبدأ معركتها الشخصية على النفايات بجمع 1300 كيلوجرام قمامة من الطرق,1
1977,2016-09-16,Iran keen to have nuclear interaction with regional states: Ali Akbar Salehi,1
1978,2016-09-16,Video: Arnold Schwarzenegger Recounts Stealing Terminator Role From O.J. Simpson and Talks Donald Trump,1
1982,2016-09-16,Jim Murray The Man Who Discovered And Fulfill Most of Nikola Tesla's Inv...,1
1984,2016-09-16,Exclusiva dieta para adelgazar 3 kilos en una semana (¡Si Funciona!),1
1987,2016-09-16,Obama Exacts Cold Revenge on Netanyahu.,1
1988,2016-09-16,Pinned to Recommended on Pinterest,1
1991,2016-09-16,PARIS - SEPTEMBER - 2016 (GONE T0 HELL),1
1992,2016-09-16,The New Geopolitics of Declining Oil Demand - The Experts,1
1994,2016-09-16,China just launched the world’s most accurate clock into space,1
1971,2016-09-16,India Loses WTO Appeal In US Solar Dispute,0
1990,2016-09-16,Human Rights Activist prevented from attending UN Human Rights Council Session by India,0
1993,2016-09-16,"Remember the young single mother who raised £330,000 for a disabled pensioner who was mugged outside his home? She is now being sued by a PR company.",0
2011,2016-09-17,"Syria's military says U.S.-led coalition struck its base in Deir el-Zour, allowing Islamic State group to advance",3915
2018,2016-09-17,ICC: Environmental destruction is a crime against humanity,1288
2022,2016-09-17,Young nurse 'attacked on Turkish bus for wearing shorts':Reports in local media claim man shouted 'those who wear shorts must die',414
2005,2016-09-17,Five Israelis wounded and four Palestinian assailants shot dead in 24 hours of attacks as violence continues,148
2024,2016-09-17,US special forces 'chased from Syria town al-Rai' - BBC News,133
2009,2016-09-17,Syrian Military Says US Struck Its Base,46
2010,2016-09-17,US jets attack Syrian Army as ISIS captures strategic mountain in Deir Ezzor,40
1997,2016-09-17,NASA accidentally sold a priceless Apollo 11 moon landing baggy and now faces a legal battle to get it back.,27
2023,2016-09-17,"Russia 'could run out of cash reserves in 2017': Despite being a major oil producing nation, pension pots may have to be raided to cover budget shortfalls, on which much of the reserve funds have already been spent",15
2025,2016-09-17,How Mosul’s Liberation Could Lead to Another Iraqi Civil War,15
1998,2016-09-17,Terminally ill child first to be helped to die in Belgium,5
2003,2016-09-17,Russian Military Says 62 Syrian Soldiers Reportedly Killed in US-Led Airstrike on Military Base,5
1996,2016-09-17,Pan-Armenian Games Kick Off in Tehran,4
1995,2016-09-17,UK-shaped hole in EU's Bratislava agenda,2
2027,2016-09-17,Congo's electoral commission formally requests vote delay | Metro News,2
1999,2016-09-17,Elvluo VR Bike Virtual Reality Bicycle for GYM,1
2000,2016-09-17,Russian military says 62 Syrian soldiers reportedly killed in US-led airstrike on military base,1
2001,2016-09-17,Iphone 7 Unboxing: Jet Black vs Matte Black New Full Video 2016,1
2002,2016-09-17,VIDEO: Moment Terrorists Attack Repelled by Syrian Army Troops in Quneitra,1
2004,2016-09-17,Tiziana Cantone's family calls for justice after suicide over sex tape,1
2006,2016-09-17,Social Bookmarking sites | Social Networking | Facebook like website,1
2007,2016-09-17,Texting drivers: Penalty points and fines to double,1
2008,2016-09-17,Absolute dearth of roles for women: Daniel Radcliffe,1
2012,2016-09-17,US-led coalition aircraft strike Syrian army positions – Syrian General Command,1
2013,2016-09-17,Check out this post on Ello,1
2014,2016-09-17,"BREAKING: Bomb Explodes At Military Charity Event, Here's What We Know",1
2015,2016-09-17,Former police chief’s son arrested after father claimed Turkey deliberately supported ISIS,1
2016,2016-09-17,Translated video of US forces being forced to leave positions in Syria,1
2017,2016-09-17,"BREAKING: Possible terrorist attack in New Jersey, USA. A pipe bomb has exploded at the Jersey SHORE during a Veterans and Sailors 5k race.",1
2019,2016-09-17,Play an infertile woman in 'Parched': Radhika,1
2021,2016-09-17,"BREAKING: Syrian government says US-led coalition struck its forces, allowing Islamic State group to advance.",1
2026,2016-09-17,Journey matters more than destination: Sushant Singh Rajput,1
2028,2016-09-17,Locksmith West Valley Utah,1
2029,2016-09-17,Applying For Nigerian Visa for Infants,1
2020,2016-09-17,SEE IT: Rice marching band mocks Baylor’s sexual assault scandal during halftime performance,0
2049,2016-09-22,Chinese officials criticised over 'ugly' Great Wall repairs,76
2054,2016-09-22,Euronews: Thai King Dead,55
2046,2016-09-22,"Accept Palestine or face ‘sea of hatred,’ Jordanian king warns Israel",11
2056,2016-09-22,"Aleppo hit by worst strikes for months as Putin, Assad ignore U.S. plea",7
2044,2016-09-22,Russia bans top LGBT news site,6
2060,2016-09-22,Turkey won’t take part in Raqqa operation if Kurdish militants do: Presidential spokesman - MIDEAST,6
2032,2016-09-22,"White House Staffer's Leaked Email Reveals Secret Service Plans, Michelle Obama Documents",5
2064,2016-09-22,Russian Votes From Syria Hint At Size of Military Deployment,5
2061,2016-09-22,Paris Climate Deal Passes Milestone as 20 More Nations Sign On,4
2033,2016-09-22,Yemen: '26 killed' by coalition air strike in Hodeidah,2
2034,2016-09-22,UN resumes aid convoys to Syria days after deadly airstrikes,2
2041,2016-09-22,"Iceland allows Angelína in raft of newly approved baby names - Personal Names Committee gives green light to Angelína along with 10 others, but the days of the committee could soon be numbered",2
2030,2016-09-22,"when the violence in syria rises again , the rebillions sease to control the yelen neighborhood",1
2031,2016-09-22,How Debates Can Define Presidential Elections Morning Joe MSNBC,1
2035,2016-09-22,Assad blames US for Syria truce collapse,1
2036,2016-09-22,Mideast conflict not about settlements: Netanyahu,1
2037,2016-09-22,Selenium - Java (Best for automation beginner)- on Live App,1
2038,2016-09-22,Palestinians prisoners subjected to assault and torture at Israeli Etzion Prison,1
2040,2016-09-22,"Only Syrian regime knows where Eli Cohen's body is, political activist says",1
2042,2016-09-22,State of emergency called after second night of unrest in Charlotte on c...,1
2043,2016-09-22,Turkish army targets Syria after rocket attack blamed on Daesh,1
2047,2016-09-22,Buy iphone 7 for Rs 1700 Deposit and Aadhar CardLoop21,1
2050,2016-09-22,"Micromax Canvas 7 release date, price, specifications and Features - Gadgets World",1
2052,2016-09-22,European Court of Human Rights dismisses claims by families of Srebrenica victims,1
2053,2016-09-22,Eforstore Unisex Winter Warm Knitted Thicken Hollow Out Neckerchief Knit Infinity Scarf Christmas New Year Birthday Gift For Your Family and Friends Women Men (Beige) Review,1
2055,2016-09-22,"BLU Life One X2 with 5.2-inch 1080p display, Snapdragon 430 announced - Gadgets World",1
2057,2016-09-22,"Yellen helps Clinton dodge a bullet: Federal Reserve policymakers keep their key interest rate steady, putting the central bank on the sidelines until after Election Day.",1
2058,2016-09-22,"Turkey not to join Raqqa operation alongside PYD, YPG",1
2059,2016-09-22,Mesh Rashifal 2017 in Hindi II Mesh Horoscope 2017 मेष राशिफल 2017,1
2062,2016-09-22,"IIT Bombay students' satellite 'Pratham' is all set for launch, and here's why it is going to be one of the most historical space missions ever",1
2063,2016-09-22,UN rights official warns large-scale crisis on the horizon in Congo,1
2039,2016-09-22,Tormented house-proud woman's home had flooded 40 times in just 13 years before she was found hanged,0
2045,2016-09-22,Large Hominin Teeth Found in Hobbits’ Cave,0
2048,2016-09-22,"Priscilla Chan and Mark Zuckerberg aim to 'cure, prevent and manage' all disease",0
2051,2016-09-22,Indian technology institute to put the art of happiness under the microscope,0
2079,2016-09-23,SpaceX says Falcon 9 explosion at Cape Canaveral on Sept. 1 likely caused by 'breach in the cryogenic helium system',286
2081,2016-09-23,Syria announces diplomats fail to renew truce,18
2084,2016-09-23,Syria war will drag on as part of global conflict: President Assad,17
2091,2016-09-23,Russian Toddler Survives After Three Days in Wilderness,17
2065,2016-09-23,Mideast Quartet warns that Israeli settlements eroding two-state solution,15
2085,2016-09-23,Yemen president vows at U.N. to 'extract Yemen from claws of Iran',11
2073,2016-09-23,European Union warns Pakistan,10
2088,2016-09-23,Explosive new evidence suggests David Cameron himself broke election laws to win in 2015,9
2093,2016-09-23,How the world failed Syria this week,9
2074,2016-09-23,Brexit forever? Britain keeps the world waiting for EU divorce papers,7
2076,2016-09-23,Alcosynth is being tested and it could kill the hangover forever,7
2096,2016-09-23,On the Front Lines Approaching the ISIS-Occupied Metropolis of Mosul,3
2068,2016-09-23,"Footage shows fatal encounter between Charlotte cops, Keith Lamont Scott",2
2072,2016-09-23,Polish lawmakers push on with near-total ban on abortion: Ruling PiS party committed to law banning most terminations and making maximum jail term for practitioners five years,2
2080,2016-09-23,Bloomberg Launches New Forex Trading &amp; Reporting System in the Philippines,2
2094,2016-09-23,ISIS Digs Fiery Moat around Mosul amid Fruitless Ceasefire Talks,2
2066,2016-09-23,Lavrov to UN: Important not to let US-Russia agreements on Syria collapse,1
2070,2016-09-23,European Union will not strike final TTIP with US before President Barack Obama leaves,1
2077,2016-09-23,Government of French Polynesia meets with the Seasteading Institute – looks forward to building floating islands,1
2078,2016-09-23,The stars of Rio 2016,1
2082,2016-09-23,EURO 2012 team of the tournament,1
2083,2016-09-23,A Six year old kid is teaching a Lesson to the World to be peaceful and love each.,1
2087,2016-09-23,"US airstrikes on Syrian troops were ‘intentional,’ lasted nearly 1 hour – Assad to AP",1
2097,2016-09-23,"Aleppo Strikes Kill 12 Members of Same Family, Observer Group Says",1
2098,2016-09-23,Microsoft to Repurchase Shares Worth $40B Boost Dividend,1
2099,2016-09-23,"Samsung Galaxy On7 2016 with 5.5-inch 1080p display,fingerprint sensor announced - Gadgets World",1
2067,2016-09-23,German military carried out first foreign cyber-attack in Afghan hostage op,0
2069,2016-09-23,WATCH: ISIS Imprisoned ‘Russian Intelligence Officer’ Delivers Message to Russia,0
2071,2016-09-23,South Korea reveals it has a plan to assassinate Kim Jong Un,0
2075,2016-09-23,Dolph Ziggler and WWE Superstars to Fill The Bryce Jordan Center.,0
2086,2016-09-23,3 men charged in East Vancouver kidnapping (I know suspects personally),0
2089,2016-09-23,"India Hits Back at Pakistan, Calling Archrival ‘Terrorist State’",0
2090,2016-09-23,White Helmets 'targeted' in Aleppo as cease-fire hopes fade,0
2092,2016-09-23,"UK 'did not vote for hard Brexit', George Osborne warns - BBC News",0
2095,2016-09-23,Huge python attacks man as he tries to take a selfie,0
2126,2016-09-25,Thousands across Poland protest in black against total abortion ban,666
2125,2016-09-25,Gun attack in Malmo leaves 'multiple casualties',405
2102,2016-09-25,'We will NEVER accept EU migrants quota' Hungary to vote NO in next week's referendum,162
2133,2016-09-25,Trump tells Netanyahu he’ll recognize undivided Jerusalem if president,100
2111,2016-09-25,Hungary police say Budapest blast was directed at officers,67
2113,2016-09-25,Chancellor Angela Merkel has ruled out any state assistance for Deutsche Bank AG which has lost almost half of its market value this year,64
2127,2016-09-25,"Research identifies 20,000 owners and shows how the trade permeated notable British institutions, New analysis reveals that Prince Andrew’s daughters are the direct descendants of a major slave-owning family.",46
2110,2016-09-25,"Italian judge orders man to buy books for underage prostitute he had sex with, to help her understand the damage the profession does to girls, and for instilling feminist values",37
2108,2016-09-25,"Merkel Says Germans Fulfill Refugee Duty, Now Time for EU to Act",30
2115,2016-09-25,Jordanian writer shot dead outside court before trial over cartoon,30
2118,2016-09-25,Swedish police lose control amid refugee crisis as number of 'no-go zones' rises to 55,25
2112,2016-09-25,French President Francois Hollande has acknowledged the state's culpability in abandoning Algerians who fought alongside French colonial forces in Algeria's war for independence.,23
2120,2016-09-25,Budapest explosion of unknown origin injures two police officers | World news,18
2129,2016-09-25,"Quantum computing will cripple encryption methods within decade, spy agency chief warns",16
2100,2016-09-25,Coronation Street actor Marc Anwar sacked over 'racist tweets' towards Indians,11
